Sr No,Date dd/mm/yyyy,Startup Name,Industry Vertical,SubVertical,City  Location,Investors Name,InvestmentnType,Amount in USD,Remarks,Date
1,09/01/2020,BYJU’S,E-Tech,E-learning,Bengaluru,Tiger Global Management,Private Equity Round,200000000.0,,2020-01-09
2,13/01/2020,Shuttl,Transportation,App based shuttle service,Gurgaon,Susquehanna Growth Equity,Series C,8048394.0,,2020-01-13
3,09/01/2020,Mamaearth,E-commerce,Retailer of baby and toddler products,Bengaluru,Sequoia Capital India,Series B,18358860.0,,2020-01-09
4,02/01/2020,https://www.wealthbucket.in/,FinTech,Online Investment,New Delhi,Vinod Khatumal,Pre-series A,3000000.0,,2020-01-02
5,02/01/2020,Fashor,Fashion and Apparel,Embroiled Clothes For Women,Mumbai,Sprout Venture Partners,Seed Round,1800000.0,,2020-01-02
6,13/01/2020,Pando,Logistics,"Open-market, freight management platform",Chennai,Chiratae Ventures,Series A,9000000.0,,2020-01-13
7,10/01/2020,Zomato,Hospitality,Online Food Delivery Platform,Gurgaon,Ant Financial,Private Equity Round,150000000.0,,2020-01-10
8,12/12/2019,Ecozen,Technology,Agritech,Pune,Sathguru Catalyzer Advisors,Series A,6000000.0,,2019-12-12
9,06/12/2019,CarDekho,E-Commerce,Automobile,Gurgaon,Ping An Global Voyager Fund,Series D,70000000.0,,2019-12-06
10,03/12/2019,Dhruva Space,Aerospace,Satellite Communication,Bengaluru,"Mumbai Angels, Ravikanth Reddy",Seed,50000000.0,,2019-12-03
11,13/12/2019,Rivigo,Technology,Logistics Services and Solutions,Gurgaon,"SAIF Partners, Spring Canter Investment Ltd.",Series F,20000000.0,,2019-12-13
12,17/12/2019,Healthians,B2B-focused foodtech startup,Food Solutions For Corporate,Bengaluru,"Paytm, NPTK, Sabre Partners and Neoplux",Series C,12000000.0,,2019-12-17
13,16/12/2019,Licious,E-Commerce,Online Meat And Seafood Ordering Startup,Bengaluru,Vertex Growth Fund,Series E,30000000.0,,2019-12-16
14,16/12/2019,InCred,Finance,Non-Banking Financial Company,Mumbai,Unknown,Debt Funding,5900000.0,,2019-12-16
15,14/12/2019,Trell,Video,Experience Discovery Platform,Bengaluru,Ruizheng Investment,Seed Round,2000000.0,,2019-12-14
16,11/12/2019,Rein Games,Gaming,Real money based gaming startup,Noida,Manipal Education and Medical Group (MEMG),Seed Round,50000000.0,,2019-12-11
17,20/12/2019,Lenskart.com,E-Commerce,Online Eyewear Shopping Portal,Faridabad,SoftBank Vision Fund,Series G,231000000.0,,2019-12-20
18,13/11/2019,Freshworks,Software,Business and customer engagement tools,San Francisco,"Sequoia, CapitalG, Accel",Series H,150000000.0,,2019-11-13
19,14/11/2019,Misters,Health and wellness,Men's Health and Wellness brand,Gurgaon,"Sauce.vc, Rainforest Ventures",Series B,486000.0,,2019-11-14
20,13/11/2019,Sunstone Eduversity Pvt. Ltd,Education,Elearning,Gurgaon,"Prime Venture Partners, LetsVenture, PS1 Venture and GlobalLogic co-founder Rajul Garg",Seed,1500000.0,,2019-11-13
21,17/11/2019,Burger Singh,Food and Beverage,Indian Burger Brand,Gurgaon,RB Investments,Venture,500000.0,,2019-11-17
22,18/11/2019,Healthians,Health and Wellness,Healthcare services,Gurgaon,"DG Daiwa Ventures, DG Incubation",Series B,12000000.0,,2019-11-18
23,15/11/2019,Ninjacart,B2B Marketing,Agritech,Bengaluru,Trifecta Capital Advisors,Debt Funding,26000000.0,,2019-11-15
24,20/11/2019,Aye Finance,FinTech,Financial Services To MSMEs,Gurgaon,FinTech,Debt Funding,17411265.0,,2019-11-20
25,12/11/2019,SuperGaming,Video Games,Social gaming platform,Pune,Dream Incubator,Seed Funding,1300000.0,,2019-11-12
26,20/11/2019,Clumio,SaaS,Recovery software,"San Jose,","Altimeter Capital, Sutter Hill Ventures",Series C,135000000.0,,2019-11-20
27,11/11/2019,eBikeGo,Last Mile Transportation,Electric bike rental,Amritsar,Startup Buddy,Seed,300000.0,,2019-11-11
28,19/11/2019,Digital Mall Asia,E-Commerce,Virtual e-commerce platform,Delhi,Amour Infrastructure,Seed Funding,220000000.0,,2019-11-19
29,18/11/2019,Medikabazaar,Healthcare,B2B platform for medical supplies,Mumbai,"Ackermans & van Haaren, HealthQuad, Rebright Partners, Toppan Printing",Series B,15800000.0,,2019-11-18
30,15/11/2019,Vogo Automotive,Last Mile Transportation,Scooter sharing app,Kormangala,"Matrix Partners, Stellaris Venture Partners, Kalaari Capital",Series B,283000000.0,,2019-11-15
31,19/11/2019,Furtados School of Music,Education,Music Education,Tulangan,IAN Fund and DSG Consumer Partners,Unknown,200000000.0,,2019-11-19
32,25/11/2019,Paytm,FinTech,Mobile Wallet,Noida,Vijay Shekhar Sharma,Funding Round,1000000000.0,,2019-11-25
33,04/10/2019,Dunzo,Customer Service,Delivery Service,Bengaluru,Lightbox,Series D,45000000.0,,2019-10-04
34,02/10/2019,Udaan,B2B,Business development,Bengaluru,"Altimeter Capital, DST Global",Series D,585000000.0,,2019-10-02
36,05/09/2019,FPL Technologies,FinTech,Financial Services,Pune,"Matrix Partners India, Sequoia India",Maiden Round,4500000.0,,2019-09-05
37,04/09/2019,Cashflo,FinTech,Invoice discounting platform and SME lending marketplace,Mumbai,SAIF Partners,Series A,3300000.0,,2019-09-04
38,04/09/2019,Digital F5,"Advertising, Marketing",Digital marketing firm,Mumbai,TIW Private Equity,Private Equity Round,6000000.0,,2019-09-04
39,04/09/2019,3rdFlix,SaaS,Education Technology,Hyderabad,Exfinity Venture Partners,pre-series A,5000000.0,,2019-09-04
40,04/09/2019,75F,IoT,Building automation system,Burnsville,Breakthrough Energy Ventures,Series A,18000000.0,,2019-09-04
41,04/09/2019,Myelin Foundry,Information Technology,Deep-technology,Bengaluru,Endiya Partners,Seed,1000000.0,,2019-09-04
42,04/09/2019,Atomberg Technology,Consumer Technology,"Consumer Electronics, Home Appliances",Mumbai,A91 Partners,Series A,10000000.0,,2019-09-04
43,04/09/2019,GOQii,Health and Wellness,Wearable Fitness Bands,Menlo Park,Bennett Coleman and Company Ltd (BCCL),Series C,450000000.0,,2019-09-04
44,03/09/2019,Vyapar App,Accounting,Mobile-based Accounting Software,Bengaluru,"India Quotient, Axilor Ventures",Series A,5000000.0,,2019-09-03
45,01/08/2019,CarDekho,E-Commerce,Automotive,Gurgaon,SC GG India Mobility Holdings LLC,Series C,20000000.0,,2019-08-01
46,01/08/2019,Progcap,Finance,Supply Chain Management,New Delhi,Sequoia India,Series A,5000000.0,,2019-08-01
47,01/08/2019,MyPetrolPump,Retail,Fuel Delivery,Bengaluru,Unknown,Seed Funding Round,1600000.0,,2019-08-01
48,01/08/2019,Alteria Capital,Finance,VC Funds,Mumbai,"Azim Premji, Binny Bansal",Single Venture,140000000.0,,2019-08-01
49,01/08/2019,Pine Labs,Information Technology,Last-mile retail transaction technology,Noida,Pine Labs Pte Ltd,Corporate Round,38080000.0,,2019-08-01
50,12/08/2019,Meesho,E-Commerce,Social Commerce,Bengaluru,Naspers,Series D,125000000.0,,2019-08-12
51,13/08/2019,Cars24,E-Commerce,Car Retail,Gurugram,MS Dhoni,Series D,11000000.0,,2019-08-13
52,13/08/2019,Uniphore,Customer Service Platform,Conversational AI,Palo Alto,March Capital Partners,Series C,51000000.0,,2019-08-13
53,23/08/2019,Zendrive,Automotive,Road Safety Analytics,San Francisco,XL Innovate,Series B,37000000.0,,2019-08-23
54,23/08/2019,Lo! Foods,Consumer Goods,Low carb food for Diabetics,Bengaluru,"Rashmi Daga (founder, FreshMenu), Raveen Sastry (co-founder, Myntra) and Mitesh Shah (finance chief, BookMyShow)",Seed Round,500000.0,,2019-08-23
55,23/08/2019,Tala,FinTech,Digital Lending Platform,Santa Monica,RPS Ventures,Series D,110000000.0,,2019-08-23
56,22/08/2019,INDwealth,FinTech,Wealth Management,Gurgaon,Tiger Global Management,Venture Round,15000000.0,,2019-08-22
57,21/08/2019,HungerBox,Food and Beverage,B2B Foodtech,Bengaluru,One97 Communications Ltd.,Series C,6590000.0,,2019-08-21
58,23/08/2019,AdmitKard,EdTech,University Admissions,Noida,Growth DNA,Seed Round,1000000.0,,2019-08-23
60,19/08/2019,Grofers,E-Commerce,Grocery Delivery,Gurgaon,Softbank Vision Fund,Series F,70000000.0,,2019-08-19
61,27/08/2019,Rapido Bike Taxi,Transportation,Bike Taxi,Bengaluru,Westbridge Capital,Series B,3900000000.0,,2019-08-27
62,02/07/2019,RenewBuy,Finance,Auto Insurance,Gurgaon,"Lok Capital, IIFL Wealth",Series B,19000000.0,,2019-07-02
63,02/07/2019,Atlan,Information Technology,Big Data,Singapore,WaterBridge Ventures,Pre-Series A,2500000.0,,2019-07-02
64,01/07/2019,WizCounsel,Compliance,Consulting,New Delhi,Kapil Dev,Angel,145000.0,,2019-07-01
65,03/07/2019,Ola Cabs,Transport,Cabs,Kormangala,"DIG Investment Ab, Deshe Holdings, Samih Toukan and Hussam Khoury",Series J,1000000.0,,2019-07-03
66,01/07/2019,Uniphore,Artificial Intelligence,Speech Recognition,Taramani,March Capital Partners,Series C,38080000.0,,2019-07-01
67,04/07/2019,Daalchini Technologies,Food and Beverage,Digital Vending Machine,New Delhi,Artha Venture,Seed Round,500000.0,,2019-07-04
68,10/07/2019,"""BYJU\\'S""",EdTech,Education,Bengaluru,Qatar Investment Authority,Private Equity Round,150000000.0,,2019-07-10
69,11/07/2019,Moglix,E-Commerce,Industrial Tools and Equipments,Singapore,"Composite Capital Management, Sequoia Capital India, Tiger Global Management",Series D,60000000.0,,2019-07-11
70,10/07/2019,Ezyhaul,Tech,Logistics,Singapore,Undisclosed,Series B,16000000.0,,2019-07-10
71,10/07/2019,Indus OS,Tech,Smartphone Operating System,Andheri,Ventureast,Series B,5750000.0,,2019-07-10
72,10/07/2019,HealthAssure,Health Care,Primary care medical network,Mumbai,Blume Ventures,Series A,2500000.0,,2019-07-10
73,09/07/2019,House of Msasaba,Luxury Label,Clothes and Apparel,Mumbai,Binny Bansal,Series A,1000000.0,,2019-07-09
74,08/07/2019,Board Infinity,EdTech,Full-stack career platform,Chembur,Multiple Angel Investors,Angel Round,319605.0,,2019-07-08
75,05/06/2019,NoBroker,E-Commerce,Real Estate,Bengaluru,General Atlantic,Series C,51000000.0,,2019-06-05
76,04/06/2019,Bira91,Food and Beverage,Brewery,New Delhi,Anicut Capital,Debt Funding,10000000.0,,2019-06-04
77,03/06/2019,FabHotels,E-Commerce,Hospitality,Gurgaon,"Goldman Sachs, Accel Partners and Qualcomm",Unknown,4889975.54,,2019-06-03
78,03/06/2019,Avail Finance,Finance,FinTech,Bengaluru,Matrix Partners,Series A,9000000.0,,2019-06-03
79,04/06/2019,BharatPe,Finance,FinTech,New Delhi,Insight Partners,Series B,75000000.0,,2019-06-04
80,04/06/2019,Recykal,Waste Management Service,Optimization,Hyderabad,"Triton Investment Advisors, Pidilite Industries director Ajay Parekh",pre-Series A,26000000.0,,2019-06-04
81,03/06/2019,Agara Labs,Deep-Tech,Artificial Intelligence,Bengaluru,Blume Ventures and RTP Global,pre-Series A,2500000.0,,2019-06-03
82,06/06/2019,Sistema.bio,Agriculture,Hybrid Reactor Biodigestor,Nairobi,"Shell Foundation, DILA CAPITAL, Engie RDE Fund, EcoEnterprise Fund, EDFIMC (ElectriFI), Endeavor Catalyst Fund, CoCapital, Triodos, Alpha Mundi, and Lendahand",Unknown,2739034.68,,2019-06-06
83,06/06/2019,Chakr Innovation,Energy,Renewable Energy,New Delhi,IAN Fund,Series A,26000000.0,,2019-06-06
84,06/06/2019,Pratilipi,Digital Media,E-Books,Bengaluru,Qiming Venture Partners,Series B,15109500.0,,2019-06-06
85,10/06/2019,Bolo App,Digital Media,Video Platform,Bengaluru,Nexus Venture Partners,Seed Funding,430200.0,,2019-06-10
86,10/06/2019,OkCredit,FinTech,Financial Services,Haryana,Tiger Global Management,Series A,15500000.0,,2019-06-10
87,06/06/2019,Biz2Credit,FinTech,Online Lending Platform,New York,WestBridge Capital,Series B,52000000.0,,2019-06-06
88,08/06/2019,Vogo Automotive Pvt. Ltd.,Transportation,Dockless Scooter Rental Company,Karnataka,Alteria Capital,Debt Funding,3584000.0,,2019-06-08
89,04/06/2019,Leegality,Services,Digital Documentation,Mumbai/Bengaluru,Mumbai Angels,Series A,3400000.0,,2019-06-04
91,06/05/2019,Saahas Zero Waste,Waste Management Service,Optimization,Bengaluru,C4D Partners,Venture - Series Unknown,868600.0,,2019-05-06
93,01/05/2019,BlackBuck,Transport,Logistics,Bengaluru,"Goldman Sachs Investment Partners and Silicon Valley-based Accel, Wellington, Sequoia Capital, B Capital, LightStreet, Sands Capital and International Finance Corporation,",Series D,150000000.0,,2019-05-01
94,02/05/2019,Zenoti,Saas,Beauty and Wellness Industry,Hyderabad,Tiger Global Management,Series C,50000000.0,,2019-05-02
95,28/05/2019,Ather Energy,Automobile,Electric Vehicle,Bengaluru,Sachin Bansal,Series C,51000000.0,,2019-05-28
96,28/05/2019,FreshVnF,Agtech,Fresh Agriculture Produces,Mumbai,Equanimity Ventures,Seed Round,140000000.0,,2019-05-28
97,30/05/2019,GlowRoad,E-commerce,Retail,Bengaluru,"Korea Investment Partners, Vertex Ventures",Series B,11500000.0,,2019-05-30
98,31/05/2019,Bira91,Food and Beverage,Brewery,New Delhi,Sixth Sense Ventures,Series B,5600000.0,,2019-05-31
99,16/04/2019,Kuvera,Finance,Wealth Management,Bengaluru,Eight Roads,Series A,45000000.0,,2019-04-16
100,12/04/2019,Medlife,E-commerce,Online Medicine,Bengaluru,Prasid Uno Family Trust,Private Equity,17000000.0,,2019-04-12
101,10/04/2019,Kabadiwala,E-commerce,Waste Management,Bhopal,"Unilever, Beehive Capital Advisor, ABCOM Investments, Parekh Marine Transport,",Private Equity,430665.0,,2019-04-10
102,13/04/2019,Tripoto,Social Media,Travel,New Delhi,"Orchid India, Hornbill Orchid India Fund, Chiratae Ventures (formerly IDG Ventures), 3one4 Capital, Lasmer NV",Series B,3591375.0,,2019-04-13
103,12/04/2019,Azah,Health and Wellness,Organic wellness,Gurugram,Unnamed angel investors,Seed Funding,200000.0,,2019-04-12
104,11/04/2019,Setu,Fintech,Banking,Bengaluru,Lightspeed India Partners,Seed Funding,3500000.0,,2019-04-11
105,10/04/2019,Toppr,Edtech,E-learning,Mumbai,Milestone,Debt and Preference capital,6320820.0,,2019-04-10
106,10/04/2019,Craftsvilla,E-commerce,Fashion and Apparel,Mumbai,Supera Pte Ltd,Inhouse Funding,2443495.0,,2019-04-10
107,10/04/2019,Unacademy,Edtech,E-learning,Bengaluru,Kalyan Krishnamurthy,Seed/ Angel Funding,307000.0,,2019-04-10
108,11/04/2019,CleverTap,SaaS,Mobile analytics and marketing,Mumbai,"Sequoia India, Tiger Global Management, Accel Partners",Series B,26000000.0,,2019-04-11
109,19/04/2019,My Healthcare,E-commerce,Software Solutions,Bengaluru and Gurugram,Sixth Sense Ventures,Series A,3000000.0,,2019-04-19
110,19/04/2019,KrazyBee,E-commerce,Lending Platform,Bengaluru,"BAC Acquisitions, Unifi AIF, BRD Securities, Northern R Capital",Debt,5000000.0,,2019-04-19
111,17/04/2019,Shuttl,Transportation,Bus Aggregation,Gurugram,New Atlantic Ventures,Venture Round,5000000.0,,2019-04-17
112,17/04/2019,Increff,Technology,Supply-chain technology solutions,Bengaluru,"021 Capita, Binny Bansal",Series A,3000000.0,,2019-04-17
114,08/02/2019,Zilingo,Ecommerce,Fashion & Apparel,India/Singapore,"Sequoia Capital and Temasek Holdings, EDBI, Burda Principal Investments, and Sofina",Series D,226000000.0,,2019-02-08
115,13/02/2019,NanoClean Global,Nanotechnology,Anti-Pollution,New Delhi,"LetsVenture, PitchRight Venture, 91SpringBoard, AL Nour International Holdings and Mark V Investments",Series A,600000.0,,2019-02-13
116,14/02/2018,OyoRooms,Hospitality,Budget Rooms,Gurgaon,DiDi Chuxing,Equity,100000000.0,,2018-02-14
117,03/01/2019,CarDekho,Automobile,Online Marketplace,Jaipur,"Sequoia India, Hillhouse Capital, Alphabet\\xe2\\x80\\x99s growth investment arm Capital G and Axis Bank",Series C,110000000.0,,2019-01-03
118,04/01/2019,Vyome Therapeutics Inc.,Health and Wellness,Specialty pharmaceutical,India/US,"Iron Pillar, Perceptive Advisors, Romulus Capital and Kalaari Capital",Series D,22000000.0,,2019-01-04
119,04/01/2019,Samunnati Financial Intermediation & Services Pvt. Ltd,Finance,Non-banking financial company,Chennai,"MASSIF, a Dutch government fund",Debt-Funding,5000000.0,,2019-01-04
120,04/12/2018,Manch,Social Media,Hyperlocal Content,Delhi,Stellaris Venture Partners,Seed Funding,700000.0,,2018-12-04
121,01/12/2018,UrbanClap Technologies Pvt. Ltd,Services Platform,Home services marketplace,New Delhi,Steadview Capital and Vy Capital.,Series D,50000000.0,,2018-12-01
122,02/12/2018,Guiddoo,Travel Tech,Platform for travel agents,Mumbai,Individual Investors,Pre-Series A,800000.0,,2018-12-02
123,02/12/2018,Career Anna,Online Education,"Video-based certification, trainings",Gurugram,Individual Investors,Pre-Series A,572000.0,,2018-12-02
124,04/12/2018,Nagpur Wholesale,Online Marketplace,eCommerce,Nagpur,Omphalos Ventures India LLP,Seed Funding,143000.0,,2018-12-04
125,06/12/2018,ShopKirana,B2B,eCommerce,Indore,"Info Edge, AET Fund, Akatsuki and Incubate Fund from Japan and Better Capital AngelList syndicate.",Seed Funding,2000000.0,,2018-12-06
126,06/12/2018,BuildSupply,"SaaS, Ecommerce","Real Estate, ERP",Gurugram,"Venture Highway, GREE Ventures, Space Matrix, Individual Investors",Series A,3500000.0,,2018-12-06
127,01/11/2018,GoDesi,Food and Beverage,Regional Flavours,Bengaluru,Lead Angels Network,Seed/ Angel Funding,138995.0,,2018-11-01
128,03/11/2018,Veritas Finance Ltd.,NBFC,MSME Finance,Chennai,"Norwest Venture Partners, CDC Group, the UK\\xe2\\x80\\x99s Development Finance Institution and P Surendra Pai",Series D,27799000.0,,2018-11-03
129,06/11/2018,Meesho,Ecommerce,Social Commerce,Bengaluru,"Shunwei Capital, DST Partners and RPS Ventures",Series C,50000000.0,,2018-11-06
130,08/11/2018,Mobile Premier League,Gaming,Mobile e-Sports,Bengaluru,Undisclosed,Series A,500000.0,,2018-11-08
131,08/11/2018,A&R Bon Vivants,Food,Meat Retail Chain,Jaipur,"RB Investments, Singapore",Equity,1000000.0,,2018-11-08
132,12/11/2018,Blackbuck,Food Tech,POS For Online Ordering,"New York, Bengaluru",Tiger Global,Series A,1000000.0,,2018-11-12
133,12/11/2018,MilkBAsket,Food,Micro-delivery grocery service,New Delhi,Mayfield Fund,Series B,1300000.0,,2018-11-12
134,13/11/2018,DriveU,Transport,On-Demand Drivers,Bengaluru,Stevens Creek Ventures,Mezzanine,1000000.0,,2018-11-13
135,14/11/2018,CleanseCar,Services,Car Wash,Bengaluru,Venture Catalysts,Seed/ Angel Funding,500000.0,,2018-11-14
136,19/11/2018,Automation Anywhere,Automation,Robotics,California,SoftBank Vision Fund,Series B,300000000.0,,2018-11-19
137,20/11/2018,HealthifyMe,Health and Wellness,Wellness Coach,Bengaluru,"Sistema Asia Fund, VC Samsung NEXT, Chiratae Ventures, Inventus Capital, Blume Ventures and Innoven Capital.",Series B (Extension),6000000.0,,2018-11-20
138,21/11/2018,Genius Corner,Education,Personalized Learning,Noida,Individual investors,Seed Funding,278000.0,,2018-11-21
139,22/11/2018,Aavishkaar-Intellecap Group,Investment,SME Funding,Mumbai,Teachers Insurance and Annuity Association (TIAA),Equity Based Funding,31000000.0,,2018-11-22
141,23/11/2018,Signzy,Financial Tech,Digital Onboarding Solution,Mumbai/Bengaluru,"Stellaris Venture Partners and Kalaari Capital, Rajan Anandan from Google, Dilip Khandwelwal from SAP Labs India, and Amrish Rau from PayU India",Series A,3400000.0,,2018-11-23
142,24/11/2018,Engineer.ai,Software,AI Platform,India/US,"Lakestar and Jungle Ventures, Softbank\\xe2\\x80\\x99s DeepCore.",Series A,29500000.0,,2018-11-24
143,25/11/2018,InCred Finance,Finance,SME Lending,India,"Paragon Partners, Individual Investors",Private Equity,42000000.0,,2018-11-25
144,25/11/2018,Roposo,Social Media,Video Sharing,Delhi,Bertelsmann India Investments,Series B,1700000.0,,2018-11-25
146,02/10/2018,Origo Commodities India Pvt. Ltd,Logistics,Supply Chain,Hyderabad,"Cooperative Oikocredit, Caspian and Hivos-Triodos Fund",Seed/ Angel Funding,11000000.0,,2018-10-02
147,04/10/2018,Grover Zampa,Food,Wine,Mumbai,Ravi Viswanathan,Private Equity,8200000.0,,2018-10-04
148,05/10/2018,Droom,Automobile,New and Used Cars Platform,Gurgaon,ZigExN,Series E,3000000.0,,2018-10-05
149,11/10/2018,Innov8,Real Estate,Co-Working,New Delhi,Credence Family Office,Pre-Series A,4000000.0,,2018-10-11
150,12/10/2018,Blackbuck,Logistics Tech,Largest Trucking Platform,Bengaluru,Sequoia Capital India,Private Funding,14680000.0,,2018-10-12
151,12/10/2018,LetsTransport,Logistics Tech,Book Trucks Online,Bengaluru,Fosun International,Series C,12000000.0,,2018-10-12
152,01/09/2018,Netmeds,Consumer Internet,Online Pharmacy Chain,Chennai,"Sistema Asia Fund, Sistema JSFC and Tanncam Investment",Private Equity,35000000.0,,2018-09-01
153,03/09/2018,Udaan,B2B Platform,Logistics and Shipping,Bengaluru,DST Global and Lightspeed Venture Partners\\xe2\\x80\\x99 global fund.,Private Equity,225000000.0,,2018-09-03
154,03/09/2018,Daily hunt,Consumer Internet,News and ebooks Mobile App\\xc2\\xa0,Bengaluru,Falcon Edge,Private Equity,6390000.0,,2018-09-03
155,04/09/2018,3HCare,Healthcare,Healthcare Service Provider,Delhi,Unknown,Seed / Angel Funding,1000000.0,,2018-09-04
157,05/09/2018,Nykaa,Consumer Internet,Online Marketplace For Multi-brand Beauty Cosmetic and Wellness Products,Mumbai,Lighthouse,Private Equity,157200000.0,,2018-09-05
158,05/09/2018,Mad Street Den,Technology,Computer Vision And Artificial Intelligence (Ai) Platform,Chennai,KDDI\\xc2\\xa0,Private Equity,1500000.0,,2018-09-05
159,06/09/2018,Dream11,Consumer Internet,Online Gaming Platform,Mumbai,"Tencent, Kalaari Capital and Private equity firm Multiples Alternate Asset Management",Private Equity,100000000.0,,2018-09-06
160,10/09/2018,MamaEarth,Healthcare,Online Marketplace For Mother and Babycare Products,Gurugram,Stellaris Ventures & Others,Private Equity,4000000.0,,2018-09-10
161,11/09/2018,AutoGrid,Technology,AI-Based Energy Optimisation and Control Provider,Bengaluru,"CLP Holdings Group, Innogy, \\xc3\\x98rstead, and Tenaska",Private Equity,32000000.0,,2018-09-11
162,11/09/2018,Pharmeasy,Consumer Internet,Online Marketplace For Pharmaceutical Products,Mumbai,InnoVen Capital,Debt Funding,5500000.0,,2018-09-11
163,11/09/2018,Upwards,Fin-Tech,Online Micro Lending Marketplace,Mumbai,"Shunwei Capital,Quotient, Mayfield & Others",Private Equity,5000000.0,,2018-09-11
164,12/09/2018,Kissht,Fin-Tech,Online lending Platform,Mumbai,"Vertex Ventures Southeast Asia (SEA) and India and Sistema Asia Fund, Fosun RZ Capital, Ventureast, and Endiya Partners.\\n\\n",Private Equity,30000000.0,,2018-09-12
165,01/08/2018,dishq,Food-Tech,Personalisation Technology Firm Focusing On The Food And Beverage Industry,Bengaluru,"Farm To Fork, Arts Alliance, The Syndicate Fund, Sven Hensen, Zeroth and Artesian Venture Partners",Seed/ Angel Funding,400000.0,,2018-08-01
167,02/08/2018,Samosa Labs,Consumer Internet,Social Media and Chat Entertainment Platform,Hyderabad,Xiaomi and Sequoia Capital India,Private Equity,7000000.0,,2018-08-02
168,03/08/2018,ZiffyHomes,Consumer Internet,Online Home Rental Marketplace,Gurugram,Y Combinator,Private Equity,120000.0,,2018-08-03
169,07/08/2018,My OmNamo,Consumer Internet,Holy Platform Offering Customised Puja Packages To Individuals and Corporates,Mumbai,Unknown,Seed/ Angel Funding,1000000.0,,2018-08-07
170,07/08/2018,ShopX,Consumer Internet,Assisted E-commerce Platform,Bengaluru,Fung Strategic Holdings,Private Equity,35000000.0,,2018-08-07
171,07/08/2018,MakeMyTrip,Consumer Internet,Online Travel Aggregator,Gurugram,MakeMyTrip Limited,Private Equity,10000000.0,,2018-08-07
172,08/08/2018,Hansel io,Consumer Internet,Real-time Mobile App Management,Bengaluru,Vertex Ventures,Seed/ Angel Funding,4000000.0,,2018-08-08
173,08/08/2018,Metro Bikes,Consumer Internet,Online Bike Rental Marketplace,Bengaluru,"Sequoia Capital India Advisors, Accel Partners and G Raghunandan",Private Equity,12200000.0,,2018-08-08
174,08/08/2018,Phone Pe,Consumer Internet,UPI Payments App,Bengaluru,Flipkart,Private Equity,66000000.0,,2018-08-08
175,09/08/2018,quizizz,Ed-Tech,e-learning Platform,Bengaluru,"Nexus Venture Partners, Prime Venture Partners and Others",Seed/ Angel Funding,3000000.0,,2018-08-09
176,09/08/2018,Happy EMI,Fin-Tech,Consumer Financing Platform,Bengaluru,AJ Ventures and Jain International Trade Organisation (JITO),Seed/ Angel Funding,1000000.0,,2018-08-09
177,13/08/2018,Inthree,Consumer Internet,Rural E-commerce Platform,Chennai,"Ventureast, Orios Venture Partners and the IAN Fund",Seed/ Angel Funding,4000000.0,,2018-08-13
178,13/08/2018,Observe AI,Technology,AI Based Solutions Platform,Bengaluru,"Nexus Venture Partners, MGV, Liquid 2 Ventures, Hack VC, Emergent Ventures and Y Combinator",Private Equity,8000000.0,,2018-08-13
179,16/08/2018,Enakshi,Consumer Internet,AI Based Solutions Platform,Ahemadabad,Unknown,Seed/ Angel Funding,114811.0,,2018-08-16
180,17/08/2018,EazyDiner,Consumer Internet,Online Restaurant Table Reservation Platform,Gurugram,Denlow Investment Trust and Beenext,Private Equity,5850000.0,,2018-08-17
181,20/08/2018,Finzy,Finance,Online Loan Matchmaking Platform,Bengaluru,Unknown,Seed / Angel Funding,1000000.0,,2018-08-20
182,20/08/2018,RawPressery,Consumer Internet,Online Organic Juice Delivery Service,Mumbai,Alteria Capital,Debt Funding,4800000.0,,2018-08-20
183,22/08/2018,Pi Ventures,Technology,Applied Artificial Intelligence and IoT focused\\xc2\\xa0Platform,Bengaluru,CDC Group plc\\xc2\\xa0,Private Equity,6000000.0,,2018-08-22
184,22/08/2018,Revv,Consumer Internet,Online Indian Car Rental Platform,Gurugram,"Hyundai, Edelweiss and Beenext, Dream Incubator, Sunjay Kapoor and Telama Investment",Private Equity,14270000.0,,2018-08-22
185,26/08/2018,ZestMoney,Consumer Internet,Online Lending Platform,Bengaluru,"Xiaomi,PayU, Ribbit Capital and Omidyar Network",Private Equity,13400000.0,,2018-08-26
186,26/08/2018,Shubh Loans,Fin-Tech,\\xc2\\xa0Customer Sourcing Platform\\xc2\\xa0,Bengaluru,"Saama Capital, SRI Capital, Beenext, and Pravega Ventures",Private Equity,4200000.0,,2018-08-26
187,27/08/2018,MyUpchar,Healthcare,Local Language Health Content App,Delhi,"Nexus Venture Partners, Omidyar Network and Shunwei Capital",Private Equity,5000000.0,,2018-08-27
188,28/08/2018,Narvar,IT,Post-Purchase Customer Engagement Platform\\xc2\\xa0,Bengaluru,Accel (formerly known as Accel Partners),Private Equity,3000000.0,,2018-08-28
189,30/08/2018,True North,Finance,Private Equity Firm,Mumbai,Unknown,Private Equity,600000000.0,,2018-08-30
191,02/07/2018,Biryani By Kilo,Consumer Internet,Online Food Delivery,Gurugram,Ajay Relan and Vinay Mittal,Seed/ Angel Funding,1000000.0,,2018-07-02
192,04/07/2018,Anchanto,IT,E-commerce Fulfilment Platform,Pune,MDI Ventures & Telkom Indonesia,Private Equity,4000000.0,,2018-07-04
193,05/072018,Loan Tap,Consumer Internet,Online Lending Platform For Salaried Professionals,Mumbai,"Shunwei Capital, Tuscan Ventures, Ashish Goenka, VC firms India Quotient and Kae Capital",Private Equity,6250000.0,,
194,06/07/2018,PolicyBazaar,Consumer Internet,Online Insurance Selling Platform,Gurugram,Info Edge (India) Ltd and Temasek,Private Equity,27700000.0,,2018-07-06
195,09/07/2018,zippserv,Consumer Internet,Online Platform For Risk-Assessment Services For Real Estate Investments,Bengaluru,Info Edge (India) Ltd,Seed/ Angel Funding,440000.0,,2018-07-09
196,09/07/2018,Groww,Consumer Internet,Online Platform That Sells Direct Plans Of Mutual Funds,Bengaluru,"Insignia Ventures Partners, Lightbridge Partners & Kairos",Seed/ Angel Funding,1100000.0,,2018-07-09
197,10/07/2018,Avenue Growth,Consumer Internet,Online Platform That Connects Brands With Freelance Sales Professionals,Gurugram,"Avtar Monga, chief operating office at IDFC Bank, Aditya Malik & Others",Seed/ Angel Funding,437000.0,,2018-07-10
199,10/07/2018,Kinara Capital,Finance,Lending Platform For Micro and Small Enterprises,Bengaluru,ResponsAbility,Private Equity,5000000.0,,2018-07-10
200,10/07/2018,Shop 101,Consumer Internet,Mobile Storefront And Commerce Platform For Sellers,Mumbai,"Stellaris Venture Partners, Vy Capital, Raghunandan G, and Ramakant Sharma",Private Equity,5000000.0,,2018-07-10
201,11/07/2018,Sambandh,Consumer Internet,Online Micro Lending Platform,Rourkela,Base of Pyramid Asia (BOPA) Pte Ltd,Private Equity,2500000.0,,2018-07-11
202,12/07/2018,19th mile,IT,Artificial intelligence-based sales acceleration software platform,Gurugram,"Rishi Vasudev, Excelsior Investments, Ritesh Vohra, Praveer Kumar, Prashant Gupta and Others",Seed/ Angel Funding,180000.0,,2018-07-12
203,12/07/2018,5th Vital,Healthcare,Home diagnostics services provider,Bengaluru,Brand Capital and Others,Seed/ Angel Funding,500000.0,,2018-07-12
204,13/07/2018,MEngage,Healthcare,A Doctor-Patient Engagement Platform,Jaipur,"Siddharth Agarwal, Mahavir Sharma, Amit Singal, 100 Co-founders Lab and others.",Seed/ Angel Funding,175000.0,,2018-07-13
205,17/07/2018,Ofbusiness,Finance,Online Lending Platform For SME,Gurugram,"Creation Investments, Falcon Edge, Matrix Partners India and Zodius Capital",Private Equity,29000000.0,,2018-07-17
206,17/07/2018,Cars24,Consumer Internet,Online Used Car Marketplace,Gurugram,"Kingsway FCI Fund, KCK Global & Others",Private Equity,49700000.0,,2018-07-17
207,18/07/2018,The Ken,Consumer Internet,Subscription-Only News Website,Bengaluru,Omidyar Network & Others,Seed/ Angel Funding,1500000.0,,2018-07-18
208,19/07/2018,Book My Show,Consumer Internet,Online Ticketing Platform,Mumbai,"TPG Growth, The Rise Fund & Others",Private Equity,100000000.0,,2018-07-19
209,20/07/2018,HousingMan,Consumer Internet,Property Discovery Platform,Bengaluru,Unknown,Seed/ Angel Funding,1500000.0,,2018-07-20
210,21/07/2018,PaySense,Consumer Internet,Online Consumer Lending Platform,Mumbai,PayU & Others,Private Equity,18000000.0,,2018-07-21
212,23/07/2018,VTION,Technology,Media Analytics,Gurugram,"AngelList, Rahul Khanna, Rajeev Arora and Ram Ramsundar.",Seed/ Angel Funding,280000.0,,2018-07-23
213,23/07/2018,Log9 Materials,Technology,Nanotechnology Company Specializing In Graphene,Bengaluru,"Metaform Ventures, Hemant Luthra, Micro venture capital firm GEMS Partners and Others",Seed/ Angel Funding,436000.0,,2018-07-23
214,24/07/2018,kidovators,Ed-Tech,Skill Learning Platform,Bengaluru,Gray Matters,Seed/ Angel Funding,180000.0,,2018-07-24
215,24/07/2018,Digit,Consumer Internet,Online Insurance Startup,Pune,Fairfax,Private Equity,45000000.0,,2018-07-24
216,25/07/2018,Black Soil,Finance,Non-Banking Financial Company,Mumbai,"Allcargo Logistics, Navneet Education and Mahavir Agency",Private Equity,17000000.0,,2018-07-25
217,25/07/2018,Trell,Consumer Internet,Mobile-First Video Blogging App,Bengaluru,"BeeNext , WEH Ventures and Sprout Ventures",Seed/ Angel Funding,1250000.0,,2018-07-25
218,25/07/2018,iqlect,Technology,Data Analytics Firm,Bengaluru,Ventureast and Exfinity,Seed/ Angel Funding,2500000.0,,2018-07-25
219,26/07/2018,Entropik,IT,Software-As-A-Service Platform,Bengaluru,"Bharat Innovation, IDFC-Parampara Capital, Arthavida Ventures, Jitendra Gupta & Others",Seed/ Angel Funding,1100000.0,,2018-07-26
221,26/07/2018,TheCapitalNet,Fin-Tech,Unified Global Investments Ecosystem,Hyderabad,Lindwall Family Investments LLC (LFI),Private Equity,500000.0,,2018-07-26
222,30/07/2018,Shuttl,Consumer Internet,Bus Aggregation Platform,Gurugram,Amazon Alexa Fund & Dentsu Ventures,Private Equity,11000000.0,,2018-07-30
223,30/07/2018,Cure Fit,Consumer Internet,Health and fitness Platform,Bengaluru,"IDG Ventures, Accel Partners, Kalaari Capital and Others",Private Equity,120000000.0,,2018-07-30
224,31/07/2018,Five Star Group,Fin-Tech,Non-Bank Lending Platform For SME,Chennai,"TPG, Norwest Venture Partners, Sequoia Capital & Matrix Partners",Private Equity,100000000.0,,2018-07-31
225,31/07/2018,Healthsignz,Healthcare,Health and Well being Platform,Hyderabad,Kantilal Patel,Seed/ Angel Funding,5000000.0,,2018-07-31
226,01/06/2018,CoinTribe,Finance,Credit-Based Lending Marketplace For Small And Medium Enterprises,Gurugram,"Sabre Partners, Puneet Dalmia & Others",Private Equity,10000000.0,,2018-06-01
227,04/06/2018,Digiconectt,Technology,Sales Analytics and Enablement Platform,Bengaluru,Aspire Logistics LLC,Seed/ Angel Funding,125000.0,,2018-06-04
230,05/06/2018,Zoctr,Healthcare,Online Healthcare Aggregator,Mumbai,NB Ventures and Others,Seed/ Angel Funding,1000000.0,,2018-06-05
231,07/06/2018,Annapurna Finance,Finance,Non-Banking Financial Company,Bhubneswar,Oman India Joint Investment Fund (OIJIF),Private Equity,23000000.0,,2018-06-07
232,07/06/2018,Meesho,Consumer Internet,Online Marketplace For Resellers,Bengaluru,"Sequoia Capital India, SAIF Partners, Y Combinator and Venture Highway",Private Equity,11500000.0,,2018-06-07
233,10/06/2018,AyeFinance,Finance,Online Lending Platform,Gurugram,"CapitalG, SAIF Partners and LGT Impact Ventures",Private Equity,21500000.0,,2018-06-10
235,12/06/2018,Alpha Capital,Finance,Supplychain Finance,Mumbai,Alpha Capital,Private Equity,14800000.0,,2018-06-12
236,12/06/2018,eshakti,E-Commerce,Fashion e-tailer,Chennai,Paragon Partners,Private Equity,10100000.0,,2018-06-12
237,12/06/2018,Daily Ninja,Consumer Internet,Hyperlocal Delivery Platform,Bengaluru,Saama Capital and Sequoia Capital,Seed/ Angel Funding,3000000.0,,2018-06-12
238,13/06/2018,NirogStreet,Healthcare,An Online Platform That Connects Ayurveda Doctors With Patients,Gurugram,"Spiral Ventures, Subho Ray and Samir Kumar",Seed/ Angel Funding,300000.0,,2018-06-13
239,13/06/2018,Nivesh,Finance,Mass Market Mutual Fund Investment Platform,Noida,"LetsVenture, Rajan Anandan, Basab Pradhan, Vivek Khare and Bijoy George",Seed/ Angel Funding,450000.0,,2018-06-13
241,14/06/2018,HomeLane,Consumer Internet,Online Home Furnishing Solutions,Bengaluru,Brand Capital,Seed/ Angel Funding,3450000.0,,2018-06-14
242,14/06/2018,Network Intelligence,Technology,Cybersecurity Specialist,Mumbai,Helix Investments,Private Equity,4800000.0,,2018-06-14
243,18/06/2018,Tynor Othontics,Healthcare,Prosthetics Manufacturers,Chandigarh,Lighthouse Funds & Thuasne Participations,Private Equity,21000000.0,,2018-06-18
244,18/06/2018,Elucidata,IT,Data Analytics (SaaS),Delhi & Cambridge,Hyperplane Venture Capital and several angel investors,Seed/ Angel Funding,1700000.0,,2018-06-18
246,19/06/2018,RentSher,Consumer Internet,Online Rental Marketplace,Bengaluru,"Shorooq Investments, LetsVenture & Others",Seed/ Angel Funding,1100000.0,,2018-06-19
247,20/06/2018,Drip capital,Finance,Trade Finance Firm,Mumbai,"Accel Partners, Sequoia India, Y Combinator and others.",Private Equity,15000000.0,,2018-06-20
248,22/06/2018,WickedRide,Consumer Internet,Online Motorbike And Scooter Rental Platforms,Bengaluru,"Sequoia Capital, Accel Partners & Raghunandan Gangappa",Private Equity,9100000.0,,2018-06-22
249,25/06/2018,PolicyBazaar,Consumer Internet,Online Insurance Selling Platform,Gurugram,SoftBank Vision Fund & Info Edge (India) Ltd,Private Equity,200000000.0,,2018-06-25
250,25/06/2018,HipBar,Consumer Internet,Digital Payment Platform For Beverage Delivery,Bengaluru,Diageo India,Private Equity,4000000.0,,2018-06-25
251,25/06/2018,Sqqrl,Finance,App-based investment platform,Gurugram,Equanimity Venture Fund,Seed/ Angel Funding,1000000.0,,2018-06-25
252,26/06/2018,Paytm,Technology,Digital Payment Platform,Noida,One 97 Communications,Private Equity,8950000.0,,2018-06-26
253,26/06/2018,Sigtuple,Healthcare,Data Driven Intelligence Solutions Platform,Bengaluru,"Accel Partners, IDG Venture, Endiya Partners, pi Ventures, VH Capital, Axilor Ventures and Binny Bansal",Private Equity,19000000.0,,2018-06-26
254,27/06/2018,Wow Express,Technology,E-commerce Logistics Platform,Mumbai,Undisclosed Existing Investors As Well As The Tamarind Family Trust,Private Equity,4500000.0,,2018-06-27
255,28/06/2018,Front Desk AI,Technology,An AI Platform Offering Automated Customer Service Software,Bengaluru,Speciale Invest & Others,Seed/ Angel Funding,1100000.0,,2018-06-28
256,28/06/2018,Edureka,Ed-Tech,Online Education Platform,Bengaluru,Leo Capital,Seed/ Angel Funding,2000000.0,,2018-06-28
258,02/05/2018,OpenTap,Finance,Online Lending Platform,Chennai,Unknown High Net-Worth Individuals,Seed / Angel Funding,450000.0,,2018-05-02
259,02/05/2018,Bizongo,Consumer Internet,Aggregator For Packaging Material,Mumbai,"B Capital, International Finance Corporation (IFC), Accel Partners and IDG Ventures",Private Equity,22000000.0,,2018-05-02
260,03/05/2018,Disprz,IT,SaaS,Chennai,"IL&FS Private Equity, Kae Capital & Others",Seed / Angel Funding,2500000.0,,2018-05-03
261,07/05/2018,PaisaDukan,Consumer Internet,P2P Lending Platform,Mumbai,Unknown,Seed / Angel Funding,225000.0,,2018-05-07
262,09/05/2018,i3sysytems,Technology,AI product company For Health and Life Insurane Companies,Mumbai,"Unitus Ventures, Behram Vakil and Jerxis Vandrevala",Seed / Angel Funding,1000000.0,,2018-05-09
263,11/05/2018,Earth Food,Consumer Internet,Agri-tech,Pune,Rairah Corporation,Seed / Angel Funding,949000.0,,2018-05-11
264,14/05/2018,Nykaa,Consumer Internet,Beauty e-tailer,Mumbai,"Sunil Munjal, Harsh Mariwala, Dalip Pathak and Others",Private Equity,24000000.0,,2018-05-14
265,16/05/2018,mfine,Healthcare,Doctor-Consultation App,Bengaluru,"Prime Venture Partners, Stellaris Venture Partners and Mayur Abhaya Srisrimal",Private Equity,4200000.0,,2018-05-16
266,21/05/2018,Rocketium,Technology,Online Video Creation Platform,Bengaluru,Blume ventures,Seed/ Angel Funding,300000.0,,2018-05-21
267,21/05/2018,MilkBasket,Technology,Micro-Delivery Grocery Startup,Gurugram,"Kalaari Capital, Unilever Ventures and Blume Ventures",Private Equity,7000000.0,,2018-05-21
268,22/05/2018,Vola,Finance,Micro Lending Platform,Bengaluru,Credika and unnamed angel investors,Seed/ Angel Funding,500000.0,,2018-05-22
269,22/05/2018,Cashkumar,Consumer Internet,P2P Lending Platform,Bengaluru,LetsVenture,Seed/ Angel Funding,735000.0,,2018-05-22
270,23/05/2018,Edyoo,E-Commerce,Products For Shoolgoing Children,Bengaluru,RS Shanbag,Seed/ Angel Funding,735000.0,,2018-05-23
271,23/05/2018,Aashiyaan,Finance,Housing Finance For Low-Income Families,Kolkata,"Insistor, Oikocredit",Seed/ Angel Funding,2000000.0,,2018-05-23
272,24/05/2018,Smartivity,Ed-tech,Designer Of Toys and Learning Projects For Kids,Delhi,"Ashish Kacholi, S Chand Group",Seed/ Angel Funding,2000000.0,,2018-05-24
273,24/05/2018,Bonphulapl,Clean-tech,Oxygen Optimiser Manufacturer,Delhi,Atul Gupta and Saurabh Rastogi,Seed/ Angel Funding,293000.0,,2018-05-24
274,27/05/2018,Acko,Consumer Internet,Online Insurance Platform,Mumbai,"Amazon, Ashish Dhawan, Catamaran Ventures, NR Narayana Murthy.",Seed/ Angel Funding,12000000.0,,2018-05-27
275,28/05/2018,HWell24,Healthcare,Home Healthcare Aggregator,Mumbai,"Prashant Mehta, Mitali Pawar, Nikhil G and Bhavesh P, R Ranganathan, ONCOTRUST and Medintel Services Pvt. Ltd",Seed/ Angel Funding,200000.0,,2018-05-28
276,29/05/2018,Toffee,Consumer Internet,Online Insurance Platform,Gurugram,"Kalaari Capital, Omidyar Network and Accion Venture Labs",Seed/ Angel Funding,1500000.0,,2018-05-29
277,29/05/2018,Tonetag,Technology,Mobile Payments Technology Platform,Bengaluru,Amazon Inc. and Mastercard,Private Equity,8000000.0,,2018-05-29
279,30/05/2018,Stellaps,Technology,Iot Application Platform In Agriculture,Bengaluru,"IndusAge Partners, Bill & Melinda Gates Foundation, Qualcomm Venture, ABB Technology Ventures, Omnivore, Blume Ventures, Venture Highway and BEENEXT",Private Equity,14000000.0,,2018-05-30
280,31/05/2018,Credright,Consumer Internet,Lending Platform For SMEs,Hyderabad,"Accion Venture Lab, YourNest Venture Capital And Other Angel Investors",Seed/ Angel Funding,1300000.0,,2018-05-31
281,02/04/2018,Fitternity,Consumer Internet,Online Fitness Discovey Platform,Mumbai,"Exfinity Venture, Saha fund Partners, Arihant Patni of Patni Family Office, Anjali Bansal, Shardul Amarchand Mangaldas, Satish Khanna and Taparia family office.",Private Equity,2000000.0,,2018-04-02
282,02/04/2018,Synctag,Technology,Social Media Anlaytics Platform,Coimbatore,Subhkam Ventures and Mohit Khadaria,Seed / Angel Funding,307600.0,,2018-04-02
284,02/04/2018,Finzy,Consumer Internet,Online Loan Matchmaking Platform,Bengaluru,Unknown,Seed / Angel Funding,1300000.0,,2018-04-02
285,04/04/2018,Varthana,Finance,Loans and Services To Affordable Private Schools in India,Bengaluru,"ChrysCapital, Existing investors, Elevar Equity, LGT Impact, Omidyar Network and Kaizen Private Equity also participated in the round",Private Equity,55000000.0,,2018-04-04
286,05/04/2018,IndigoLearn,Ed-Tech,Online Education Platform,Hyderabad,"Maheshwar Peri, founder and chairman of career information portal Careers360, and Jamshed Jeejeebhoy, director at Byramjee Jeejeebhoy Pvt. Ltd were among the angels",Seed / Angel Funding,150000.0,,2018-04-05
287,05/04/2018,Vedantu,Ed-Tech,Interactive Online Tutoring Platform,Bangalore,"Accel Partners, Tiger Global And Others",Private Equity,10000000.0,,2018-04-05
288,09/04/2018,Kaleidofin,Fiinance,Digital Financial Services Platform,Chennai,Omidyar Network. Blume Ventures and Professor Shlomo Ben-Haim,Seed / Angel Funding,2800000.0,,2018-04-09
289,09/04/2018,Pipabella,Consumer Internet,Fashion Accessories Etailer,Mumbai,Fireside Ventures,Seed / Angel Funding,1000000.0,,2018-04-09
291,09/04/2018,Kriger Campus,Ed-Tech,Mobile-Based Education Network,Delhi,Unknown,Seed / Angel Funding,46140.0,,2018-04-09
293,10/04/2018,TravelTriangle,Consumer Internet,Online Travel Marketplace,Gurugram,"Fundamentum, SAIF Partners, Bessemer Venture Partners, RB investments & Others",Private Equity,12000000.0,,2018-04-10
294,12/04/2018,Letsmd,Healthcare,Platform To Discover Healthcare Financing Options,Delhi,"SRI Capital, Waterbridge Ventures and ThinKuvate",Seed / Angel Funding,1000000.0,,2018-04-12
295,12/04/2018,AyeFinance,Finance,Online Lending Platform,Gurugram,"BlueOrchard Finance Ltd, Hinduja Leyland Finance and IntelleGrow",Debt Funding,4600000.0,,2018-04-12
296,13/04/2018,mintifi,Finance,Online Lending Platform,Mumbai,Lok Capital,Seed / Angel Funding,2000000.0,,2018-04-13
297,16/04/2018,icanstay,Consumer Internet,Online Platform For Luxury Hotel Stay For Business Travelers,Delhi,Mr. Manoj Prasad,Seed / Angel Funding,500000.0,,2018-04-16
299,18/04/2018,Coverfox,Consumer Internet,Online Insurance Aggregator,Mumbai,"International Finance Corporation, Transamerica and others.",Private Equity,22000000.0,,2018-04-18
300,19/04/2018,Lenskart,Consumer Internet,Online Eyewear Retailer,Faridabad,TR Capital,Private Equity,60000000.0,,2018-04-19
302,19/04/2018,Fyle Technologies,Technology,AI Based Expense Management Platform,Bengaluru,Pravega Ventures and Beenext,Seed / Angel Funding,1100000.0,,2018-04-19
303,19/04/2018,True Balance,Technology,Mobile Balance Checking App,Gurugram,"Line Ventures Corporation, Line Corp, Naver, Shinhan Bank and TS Investment",Private Equity,23000000.0,,2018-04-19
305,22/04/2018,Doxper,Healthcare,Digitized Health-Tech Solutions For Practitioners,Mumbai,Vidal Healthcare,Seed / Angel Funding,1900000.0,,2018-04-22
306,22/04/2018,Nykaa,Consumer Internet,Beauty e-tailer,Mumbai,"Sunil Munjal, Harsh Mariwala, Dalip Pathak and Others",Private Equity,11000000.0,,2018-04-22
307,23/04/2018,Mihuru,Finance,Online Platform Providing Micro Loans For Air Travel,Mumbai,Unknown,Seed / Angel Funding,150000.0,,2018-04-23
308,23/04/2018,Capital Float,Finance,Online Lending Platform,Bengaluru,Amazon,Private Equity,22000000.0,,2018-04-23
309,25/04/2018,Trip shelf,Consumer Internet,Online Travel Marketplace,Delhi,"GEMS Advisory, Alok Mittal and Sachin Bhatia",Seed / Angel Funding,246000.0,,2018-04-25
310,26/04/2018,POPxo,Technology,Women Focussed Digital Media Platform,Delhi,"Neoplux, OPPO, IDG Ventures India, Kalaari Capital, GREE Ventures and Summit Media",Private Equity,5500000.0,,2018-04-26
312,27/04/2018,1mg,Consumer Internet,Online Pharmacy Store,Gurugram,"Sequoia Capital, Maverick Capital Ltd and HBM Healthcare Investments Ltd",Private Equity,10000000.0,,2018-04-27
313,29/04/2018,Rubique,Consumer Internet,Online Lending MarketPlace,Mumbai,"Emery Capital, Blacksoil and Kalaari Capital",Private Equity,3000000.0,,2018-04-29
314,30/04/2018,Samco,Consumer Internet,Online Stock Broker,Mumbai,Bay Capital Investments and Others,Private Equity,7500000.0,,2018-04-30
315,30/04/2018,MyLoanCare,Finance,B2C Online Loans Marketplace,Gurgaon,SAR Group,Seed / Angel Funding,978000.0,,2018-04-30
316,01/03/2018,PharmEasy,Consumer Internet,Online Pharmacy Store,Mumbai,"Bessemer Venture Partners and Orios Venture Partners, JM Financials and MEMG",Private Equity,18000000.0,,2018-03-01
317,01/03/2018,Buddy4studdy,Consumer Internet,Online Scholarship Portal,Noida,CBA Capital and others,Private Equity,3000000.0,,2018-03-01
318,01/03/2018,Urban Ladder,E-Commerce,Online Furniture Store,Bengaluru,"Sequoia Capital, SAIF Partners and Kalaari capital",Private Equity,12000000.0,,2018-03-01
319,03/03/2018,Kuvera,Consumer Internet,Online Financial Planning,Bengaluru,"Baskar Subramanian, Saket Kumar, Gaurav Suri and Ankit Kesarwani",Seed / Angel Funding,250000.0,,2018-03-03
320,04/03/2018,Gramophone,Technology,Agri-tech,Indore,InfoEdge,Seed/Angel Funding,1000000.0,,2018-03-04
321,05/03/2018,Wellthy,Healthcare,Therapeutics,Mumbai,"Ranjan Pai, Apoorva Patni, Beenext Ventures,GrowX Ventures",Private Equity,2100000.0,,2018-03-05
322,05/03/2018,MedGenome,Healthcare,"Genetic Screening, DNA Diagnostics Labs & Research Centers",Bengaluru,"HDFC Life, HDFC Asset Management",Private Equity,10000000.0,,2018-03-05
323,05/03/2018,Finova Capital,Consumer Internet,Online Lending,Jaipur,Sequoia Capital,Private Equity,6000000.0,,2018-03-05
324,05/03/2018,Hotelogix,Technology,Cloud based Online Hotel Management Software,Noida,"Vertex Ventures, Accel Partners and Saama Capital",Private Equity,5000000.0,,2018-03-05
325,04/03/2018,Livehealth,Consumer Internet,Health Service Aggregator Platform,Pune,Nexus Venture Partners,Seed / Angel Funding,1100000.0,,2018-03-04
326,06/03/2018,Ad2pro,Technology,"Creative Design, Brand, Media and Technology Platform Solutions",Chennai,Avendus Finance Pvt. Ltd,Debt Funding,9700000.0,,2018-03-06
327,06/03/2018,Coverfox,Consumer Internet,Online Insurance Aggregator,Mumbai,Aegon NV,Private Equity,7600000.0,,2018-03-06
328,08/03/2018,Pepperfry,Consumer Internet,Online Furniture Shopping Store,Mumbai,State Street Global Advisors,Private Equity,38400000.0,,2018-03-08
329,08/03/2018,Magicpin,Consumer Internet,Hyperlocal Discovery,Gurugram,Trifecta Capital,Debt Funding,1000000.0,,2018-03-08
330,12/03/2018,HealthCare,Consumer Internet,Healthcare Aggregator,Mumbai,HR Fund,Seed / Angel Funding,1000000.0,,2018-03-12
331,13/03/2018,PineLabs,Technology,Digital Payment Platform,Mumbai,"Actis, Altimeter Capital",Private Equity,82000000.0,,2018-03-13
333,14/03/2018,AvailFinance,Consumer Internet,Online Lending Platform,Bengaluru,"Matrix Partners, Bhavish Aggarwal, Ankit Bhati, Binny Bansal, Kunal Shah and Manish Patel.",Private Equity,17200000.0,,2018-03-14
334,15/03/2018,Grofers,Consumer Internet,Online Grocery Shop,Gurugram,"SoftBank, Tiger Global and Apoletto Managers.",Private Equity,62000000.0,,2018-03-15
335,19/03/2018,Fingerlix,Consumer Internet,Ready To cook Food Solution,Mumbai,Alteria Capital,Debt Funding,1310000.0,,2018-03-19
336,19/03/2018,Karma Healthcare,Healthcare,Technology enabled equitable healthcare for India,Udaipur,"1Crowd, Ankur Capital",Seed / Angel Funding,500000.0,,2018-03-19
337,19/03/2018,Zappfresh,Food & Beverages,Online Raw Meat E-tailer,Gurugram,"Amit Burman, SIDBI Venture Capital",Seed / Angel Funding,3000000.0,,2018-03-19
338,19/03/2018,CustomerSucessBox,Technology,Customer Success Software for B2B SaaS,Gurugram,"Pi Ventures, Axilor Ventures",Seed / Angel Funding,1000000.0,,2018-03-19
341,22/03/2018,Chargebee,Technology,Subscription Billing & Recurring Payments Software,Chennai,"Insight Venture Partners, Accel Partners and Tiger Global Management.",Private Equity,18000000.0,,2018-03-22
342,22/03/2018,i2i Funding,Consumer Internet,Online loan platform,Noida,SucSEED Venture Partners,Seed / Angel Funding,768000.0,,2018-03-22
343,22/03/2018,Slang Labs,Technology,Voice-based assistant platform,Bengaluru,Endiya Partners,Seed / Angel Funding,1240000.0,,2018-03-22
345,26/03/2018,Cash Suvidha,Consumer Internet,Online loan platform,Delhi,"Initia Holdings,Vipin Agarwal and others.",Seed / Angel Funding,1000000.0,,2018-03-26
346,28/03/2018,Roadcast,Technology,Fleet management and asset monitoring platform,Delhi,Unknown,Private Equity,250000.0,,2018-03-28
347,28/03/2018,Smartcoin,Finance,Micro lending company,Bengaluru,"Accion Venture Lab, Unicorn India Ventures and ISME ACE.",Seed / Angel Funding,2000000.0,,2018-03-28
348,27/03/2018,The Print,Media,News portal,Delhi,Ratan Tata,Seed / Angel Funding,535000.0,,2018-03-27
349,27/03/2018,DriveU,Technology,Professional Car Drivers Hiring App,Bengaluru,Amit Singhal and Unitus Seed Fund,Private Equity,3000000.0,,2018-03-27
350,29/03/2018,Fynd,Consumer Internet,O2O fashion ecommerce platform,Mumbai,"Google, Kae Capital, IIFL, Singularity Ventures, GrowX, Tracxn Labs, Venture Catalyst, Patni family office and Axis Capital.",Seed / Angel Funding,1133333.3333333333,,2018-03-29
351,01/02/2018,BigBasket,Consumer Internet,Online Grocery & Food Store,Bengaluru,"Alibaba, Helion Venture Partners, Bessemer Venture Partners, Ascent Capital",Private Equity,300000000.0,,2018-02-01
352,01/02/2018,Zomato,Food and Beverages,Food Ordering and Restaurant Discovery,Gurugram,Ant Financials,Private Equity,200000000.0,,2018-02-01
353,05/02/2018,Pratilipi,Publishing,E-Publishing,Bengaluru,Omidyar Network,Private Equity,4300000.0,,2018-02-05
354,05/02/2018,Asia Institute Of Medical Science,Healthcare,Super-specialty Hospital,Faridabad,CDC Group Plc,Private Equity,21000000.0,,2018-02-05
355,05/02/2018,CollegeDekho,Consumer Internet,Online platform for Higher Education Services,Gurugram,"Man Capital LLP, Girnar Software, Others",Private Equity,2000000.0,,2018-02-05
357,06/02/2018,Healthi,Healthcare,Preventive Health Checkup,Bengaluru,Montane Ventures,Private Equity,3100000.0,,2018-02-06
358,07/02/2018,Swiggy,Food and Beverages,Online Food Delivery,Bengaluru,Naspers,Private Equity,100000000.0,,2018-02-07
359,08/02/2018,Shape,Healthcare,"Online Portal for Diet,fitness and Beauty",Pune,Sandeep Mathur,Seed / Angle Funding,100000000.0,,2018-02-08
360,08/02/2018,Icertis,Consumer Internet,Enterprise Contract Management Platform,Pune,Meritech Capital Partners,Private Equity,50000000.0,,2018-02-08
361,09/02/2018,healthifyme,Healthcare,Mobile Weight Loss Coach,Bengaluru,Sistema Asia Fund,Private Equity,12000000.0,,2018-02-09
363,09/02/2018,Rupeek,Consumer Internet,Online Gold Loan,Bengaluru,"Accel Partners, Sequoia Capital",Private Equity,6830000.0,,2018-02-09
365,12/02/2018,Lendingkart,Finance,Online Lending Platform,Bengaluru,Fullerton Financial Holdings Pte Ltd & Others,Private Equity,87000000.0,,2018-02-12
367,12/02/2018,Cashify,E-Commerce,Online Selling,Gurugram,Trifecta Capital,Debt Funding,935089.0,,2018-02-12
368,13/02/2018,holachef,Food and Beverages,Online Food Delivery,Mumbai,Ashok Kumar Gajera,Seed / Angle Funding,311200.0,,2018-02-13
370,13/02/2018,IMAX Program,Ed-Tech,Individualised Progressive Learning Program,Bengaluru,"Michael & Susan Dell Foundation, LGT Impact Ventures",Private Equity,13500000.0,,2018-02-13
371,14/02/2018,Littlemore,Ed-Tech,Online Education Platform,Chennai,Kalpavriksh,Private Equity,3000000.0,,2018-02-14
372,14/02/2018,Toppr,Ed-Tech,Online Education Platform,Mumbai,Axis Capital Partners,Private Equity,100000.0,,2018-02-14
373,14/02/2018,Shirsa Labs,Ed-Tech,Integrated Kids Engagement Company,Mumbai,"Dewang Neralla, Mahesh Kothurkar,Atul Agarwal",Private Equity,500000.0,,2018-02-14
374,14/02/2018,MoneyOnMobile,Technology,mobile payment platform,Mumbai,S7 Group,Private Equity,5000000.0,,2018-02-14
375,15/02/2018,PetSutra,Consumer Internet,Online Pet Care Products,Gurugram,Michael Patrick Hickey,Seed / Angel Funding,148434.0,,2018-02-15
376,15/02/2018,Infibeam,E-Commerce,Online Retailing,Ahemadabad,Network 18,Private Equity,6230000.0,,2018-02-15
377,16/02/2018,happay,Finance,Expense Management,Bengaluru,Sequoia and Jerry Yang,Seed / Angel Funding,250000.0,,2018-02-16
378,16/02/2018,Fincash,Finance,Fin-Tech,Mumbai,"Mohammed Khan, Sameer Narayan & Others",Seed / Angel Funding,150000.0,,2018-02-16
379,19/02/2018,AyeFinance,Finance,Online Lending,Gurugram,"Hinduja Leyland Finance, IntelleGrow",Private Equity,3800000.0,,2018-02-19
380,20/02/2018,Agricxlab,Agriculture,Agri-tech,Mumbai,Ankur Capital,Seed / Angel Funding,500000.0,,2018-02-20
381,21/02/2018,Udaan,E-Commerce,B2B Marketplace,Bengaluru,Lightspeed & Yuri Milner,Private Equity,50000000.0,,2018-02-21
382,21/02/2018,Capillary,IT,SaaS,Bengaluru,"Wargburg Pincus, Sequoia",Private Equity,20000000.0,,2018-02-21
383,21/02/2018,The Healthy Billions,Healthcare,Analytics,Gurugram,"Blume Ventures, HealthQuad and Fireside Ventures",Private Equity,2100000.0,,2018-02-21
385,26/02/2018,Avishkaar Box,Ed-Tech,Education,Delhi,Auxano Deals,Private Equity,772500.0,,2018-02-26
386,26/02/2018,Planys Technologies,Technology,Robotic InspectionStartup,Chennai,"Kris Gopalakrishnan, Pratithi Investment Trust, MEMG Family Office, S Gopal",Private Equity,1040000.0,,2018-02-26
388,27/02/2018,Trilyo,Technology,AI platform for hospitality industry,Mumbai,"Startup Buddy,Amit Manocha and others",Seed / Angel Funding,250000.0,,2018-02-27
389,28/02/2018,Gaana,Technology,Online Music Streaming,Gurugram,"Tencent Holdings Ltd, Times Internet",Private Equity,115000000.0,,2018-02-28
390,28/02/2018,Credy,IT,SaaS,Bengaluru,"Y Combinator, Khosla Ventures, Vy Capital and others",Seed / Angel Funding,1400000.0,,2018-02-28
392,02/01/2018,CleverTap,Technology,Mobile App Analytics,Mumbai,"Recruit Holdings, Sequoia Capital India, Accel Partners",Angel / Seed Funding,26000000.0,,2018-01-02
393,04/01/2018,EarlySalary,Finance,Online Lending,Pune,Eight Roads Ventures India,Private,15700000.0,,2018-01-04
396,09/01/2018,Lendingkart,Finance,Online Lending,Ahmedabad,Nederlandse Financierings-Maatschappij voor Ontwikkelingslanden N.V.,Debt Funding,4700000.0,,2018-01-09
397,09/01/2018,Kinsane Entertainment Inc,Entertainment,Digital Entertainment for Children,Mumbai,Unknown,Seed/Angel Funding,2500000.0,,2018-01-09
398,10/01/2018,Tapzo,Technology,Personal Assistant,Bengaluru,RuNet & Other,Private Equity,1930000.0,,2018-01-10
399,10/01/2018,Appario Retail Pvt Ltd.,E-commerce,Retail,Delhi,Amazon-Patni JV,Private Equity,18840000.0,,2018-01-10
400,10/01/2018,Samunnati,Finance,Agricultural Loan,Chennai,"responsAbility, Elevar Equity and Accel Partners",Private Equity,23500000.0,,2018-01-10
401,10/01/2018,Sahajanand Medical Technologies,Technology,Medical Devices,Surat,Morgan Stanley Private Equity Asia,Private Equity,36230000.0,,2018-01-10
402,12/01/2018,Kuants,Technology,Algorithmic Trading,Gurgaon,"Pankaj Chopra, Ankush Gupta",Angel / Seed Funding,80000.0,,2018-01-12
403,12/01/2018,Razorpay,Technology,Payment Gateway,Bengaluru,"Tiger Global, Y Combinator",Private Equity,20000000.0,,2018-01-12
404,15/01/2018,Streak,Technology,Algorithmic Trading,Bengaluru,"Indian fintech fund, Rainmatter",Angel / Seed Funding,354600.0,,2018-01-15
405,15/01/2018,pi Ventures,Finance,Venture Capital,Bengaluru,"Sunil Kant Munjal, Hero Electronix\\xe2\\x80\\x99s corporate financing arm, Electronic Development Fund",Private Equity,25000000.0,,2018-01-15
406,15/01/2018,Newgen Software,Technology,IT,New Delhi,"Goldman Sachs, hedge fund & Others",Private Equity,20000000.0,,2018-01-15
407,17/01/2018,Rubix,Technology,Education,Pune,Polaris Fund,Private Equity,1000000.0,,2018-01-17
408,18/01/2018,ShareChat,Technology,Social,Bengaluru,"Xiaomi Singapore, Shunwei Capital",Private Equity,18200000.0,,2018-01-18
409,22/01/2018,Paperflite,Technology,IT,Chennai,The Chennai Angels,Angel / Seed Funding,400000.0,,2018-01-22
410,22/01/2018,HungerBox,Consumer Internet,Food and Beverages,Bangalore,Lionrock Capital,Private Equity,2500000.0,,2018-01-22
412,22/01/2018,OptaCredit,Finance,Alternative Lending,Chennai,DMI Finance,Private Equity,4000000.0,,2018-01-22
413,22/01/2018,AEON Learning,Technology,Education,Bengaluru,Dr. Ranjan Pai,Private Equity,3200000.0,,2018-01-22
414,23/01/2018,Milkbasket,E-commerce,Online Grocery,Gurugram,Unilever Ventures,Private Equity,3000000.0,,2018-01-23
415,24/01/2018,NeoGrowth Credit,Finance,Digital Lending,Mumbai,"LeapFrog Investments, Aspada Investment, Quona Capital",Private Equity,47000000.0,,2018-01-24
416,24/01/2018,Rao IIT Academy,Education,Coaching Services,Mumbai,Avendus Finance,Structured Debt,8600000.0,,2018-01-24
417,24/01/2018,Aye Finance,Finance,Online Lending,Gurugram,IFMR Capital,Term Loan,6240000.0,,2018-01-24
419,25/01/2018,GreyAtom,Technology,Education,Mumbai,Pravega Ventures,Private Equity,1000000.0,,2018-01-25
420,26/01/2018,Axio,Healthcare,Hemostatic Dressing Solutions,Bengaluru,RNT Capital,Private Equity,7400000.0,,2018-01-26
421,29/01/2018,eKincare,Healthcare,Technology,Hyderabad,"Ventureast, Endiya Partners, Eight Roads Ventures, Touchstone Equities, BVR Mohan Reddy",Private Equity,1500000.0,,2018-01-29
422,29/01/2018,The Wedding Brigade,Consumer internet,Online Services,Mumbai,Blume Ventures,Private Equity,1000000.0,,2018-01-29
423,30/01/2018,PeeSafe,Healthcare,Hygiene,Gurugram,"Shivani Singh, Rahul Maroli, Mitesh Shah, Venture Catalysts, Alfa Capital, Green Shots Capital, Real Time Ventures.",Private Equity,1000000.0,,2018-01-30
424,30/01/2018,BrowserStack,Technology,Browser Testing,Mumbai,Accel Partners,Private Equity,50000000.0,,2018-01-30
425,30/01/2018,Scapic,Technology,Virtual Reality,Bengaluru,"Axilor Ventures, Newfort Capital",Angel / Seed Funding,500000.0,,2018-01-30
426,30/01/2018,MoneyOnMobile,Technology,Mobile Payment Platform,Mumbai,Undisclosed Investors,Private Equity,7600000.0,,2018-01-30
427,30/01/2018,CureFit,Healthcare,Fitness,Bengaluru,"HDFC Bank, Axis Bank",Debt Funding,10000000.0,,2018-01-30
428,31/01/2018,iNurture,Technology,Education Solutions,Bengaluru,Ventureast,Private Equity,4400000.0,,2018-01-31
430,05/12/2017,Dunzo,Technology,Daily Task Management Mobile App,Bangalore,Google,Private Equity,12300000.0,,2017-12-05
431,05/12/2017,Tata Housing,Real Estate,Residential Project,Mumbai,Hines,Private Equity,23000000.0,,2017-12-05
432,05/12/2017,HandyTrain,Technology,Mobile Learning Management Platform,Goa,NB Ventures,Private Equity,1000000.0,,2017-12-05
433,05/12/2017,Mobycy,Technology,Bicycle sharing Platform,Gurgaon,Undisclosed Investors,Seed/Angel Funding,500000.0,,2017-12-05
434,06/12/2017,Greenlight Planet,Technology,Off-grid solar products platform,Mumbai,"Apis Partner, Eight Roads Ventures, Bamboo Capital Partners",Private Equity,60000000.0,,2017-12-06
435,06/12/2017,Fintobox,Technology,Child Learning & Development Platform,Chennai,Lightbox,Private Equity,7000000.0,,2017-12-06
436,07/12/2017,Mswipe,Technology,Mobile point of sale services provider,Mumbai,Eduardo Saverin,Private Equity,10000000.0,,2017-12-07
437,07/12/2017,The Label Life,E-Commerce,Home Decor and Online Fashion Portal,Mumbai,Kalpvriksh,Private Equity,3100000.0,,2017-12-07
438,07/12/2017,Cygnus Hospitals,Healthcare,Super speciality Hospitals,Gurgaon,Somerset Indus Capital Ventures,Seed/Angel Funding,750000.0,,2017-12-07
439,07/12/2017,eShakti,Ecommerce,"""Women\\'s Fashion Clothing Online Platform""",Chennai,IDG Ventures,Debt Funding,2300000.0,,2017-12-07
440,08/12/2017,Inshorts,Technology,Mobile News Curation App,Noida,Tiger Global,Private Equity,5000000.0,,2017-12-08
441,11/12/2017,Vahdam Tea,E-Commerce,Online Platform Selling Indian Tea Globally,Delhi,"Singapore Angel Network, Mumbai Angel",Private Equity,1500000.0,,2017-12-11
442,11/12/2017,Logic Roots,Technology,Educational Platform to Learn Mathematics,Mumbai,Village Capital,Seed/Angel Funding,50000.0,,2017-12-11
443,11/12/2017,Project Mudra,Technology,Assisting Visually Impaired to learn through Braille,Bengaluru,Village Capital,Seed/Angel Funding,50000.0,,2017-12-11
444,11/12/2017,Furlenco,Technology,Furniture Rental Platform,Bengaluru,Aamir Khan,Debt Funding,1200000.0,,2017-12-11
445,12/12/2017,I Can Stay,Technology,Hotel Aggregator Platform,Delhi,HT Media,Private Equity,1800000.0,,2017-12-12
446,12/12/2017,Fracktal Works,Technology,Platform based on 3D printing and Digital Manufacturing,Bengaluru,Hyderabad Angels,Seed/Angel Funding,3000000.0,,2017-12-12
447,12/12/2017,Simility,Technology,Adaptive Fraud Intelligence Platform,Hyderabad,Accel Partners,Private Equity,17500000.0,,2017-12-12
448,12/12/2017,Shopholix,E-Commerce,Fashion and Lifestyle Coupon Platform,Gurgaon,Munesh Khanna,Seed/Angel Funding,233000.0,,2017-12-12
449,13/12/2017,MindTickle,Technology,Gamification Platform to train Sales People,Pune,Canaan Partners,Private Equity,27000000.0,,2017-12-13
450,13/12/2017,Nazara Technologies,Technology,Mobile Games Development Firm,Mumbai,Rakesh Jhunjhunwala,Private Equity,27000000.0,,2017-12-13
451,13/12/2017,DocsApp,Technology,Mobile Application for Doctor Consultation,Bengaluru,Bessemer Venture Partners,Private Equity,7200000.0,,2017-12-13
453,14/12/2017,Tea Box,E-Commerce,Fresh Indian Tea Selling Platform across 112 countries,Bengaluru,RB Investments,Private Equity,7000000.0,,2017-12-14
454,14/12/2017,Transversal Technologies,Technology,Hyperlocal Video Information Sharing Platform,Bengaluru,Matrix Partners,Private Equity,6000000.0,,2017-12-14
455,14/12/2017,Curofy,Technology,Mobile App for Network of Doctors,Gurgaon,RoundGlass Partners LLC,Seed/Angel Funding,250000.0,,2017-12-14
456,14/12/2017,HomeLane,E-Commerce,Online Furniture Marketplace,Bengaluru,"Accel Partners, Sequoia Capital, RB Investments",Private Equity,10000000.0,,2017-12-14
458,15/12/2017,Purplle,E-Commerce,Beauty Products Online Marketplace,Mumbai,"Mountain Pain Capital, Suncoast Investments",Seed/Angel Funding,537000.0,,2017-12-15
459,15/12/2017,Cash Suvidha,E-Commerce,Online Micro-Lending Platform,Delhi,Unknown,Debt Funding,2700000.0,,2017-12-15
461,19/12/2017,Springboard,Technology,Online Courses and Mentoring from Experts,Bengaluru,"Costanoa, Learn Capital, Jyoti Bansal",Private Equity,9500000.0,,2017-12-19
463,19/12/2017,9Stacks,Technology,Online Poker Platform,Delhi,"Swati Gupta, Purnima Khandelwal, Maheshwar Peri, Sanjay Singh",Private Equity,1500000.0,,2017-12-19
464,20/12/2017,Your Quote,Technology,Vernacular and Video Content Platform,Bengaluru,"Axilor Ventures, E-City VEntures Atul Goel",Private Equity,1000000.0,,2017-12-20
465,20/12/2017,Spandana Sphoorty,Finance,Micro finance institution providing small ticket unsecured loans to women,Hyderabad,"""Kedaraa Capital, Ontario Teachers\\'""",Private Equity,19500000.0,,2017-12-20
466,21/12/2017,Indus OS,Technology,Regional Operating System for Smartphones,Mumbai,Omidyar Network,Private Equity,4000000.0,,2017-12-21
467,21/12/2017,EasyEcom,E-Commerce,Ecommerce enabler platform,Bengaluru,"Ambarish Gupta, Aneesh Reddy, Bold Ventures, Vona Investments",Seed/Angel Funding,150000.0,,2017-12-21
469,26/12/2017,Specsmakers,E-Commerce,Online Spects Platform for Men and Women,Chennai,Eight Roads Ventures India,Private Equity,10000000.0,,2017-12-26
471,27/12/2017,Foyr.com,Technology,Realty Tech Startup solving real life Interior Designing problems,Hyderabad,Jones Lang LaSalle,Private Equity,3800000.0,,2017-12-27
472,02/11/2017,Prest Loans,Finance,Business & SME Loans provider,New Delhi,"Manish Poddar, Arun Garg, Parmeshwar Sharma",Seed Funding,570000.0,,2017-11-02
475,03/11/2017,Vagupu,Technology,Online Tutorial Marketplace,Bangalore,Undisclosed Investors,Seed Funding,1000000.0,,2017-11-03
477,03/11/2017,Kalpnik Technologies,Technology,VR based Spiritual platform,Bangalore,Venture Catalysts,Seed Funding,500000.0,,2017-11-03
478,04/11/2017,Hevo Data,Technology,Real time data analytics & reporting,Bangalore,IDG Ventures India,Private Equity,1000000.0,,2017-11-04
482,07/11/2017,DocTalk,Technology,Doctor Patient Communication platform,Mumbai,"Matrix Partners India, Khosla Ventures",Private Equity,5000000.0,,2017-11-07
483,07/11/2017,CoveIoT,Technology,Wearable tech and Internet of Things platform,Bangalore,"Titan Co Ltd, Tata Group\\xe2\\x80\\x99s watch and jewellery retailing firm",Private Equity,5000000.0,,2017-11-07
484,08/11/2017,TalentEdge,Technology,Distance Education Learning Platform,Bangalore,Lumis Partners,Private Equity,7600000.0,,2017-11-08
485,08/11/2017,Fisdom,Finance,Mutual Fund Investment App,Bangalore,Quona Capital Management,Private Equity,3000000.0,,2017-11-08
486,08/11/2017,FarmLink,eCommerce,Online platform for Agricultural products,Mumbai,"Pioneering Ventures, Syngenta AG",Private Equity,3000000.0,,2017-11-08
487,08/11/2017,OpenApp,Technology,IoT based Tech Startup,Bangalore,"Axilor Ventures, Kumar Vembu",Private Equity,3600000.0,,2017-11-08
488,09/11/2017,NoPaperForms,Technology,Enrolment Management Platform,Delhi,Info Edge,Seed Funding,872000.0,,2017-11-09
491,10/11/2017,Qubole,Technology,Big Data based analytics platform,Bangalore,"Singtel, Innov8, Harmony Partners",Private Equity,25000000.0,,2017-11-10
493,13/11/2017,Universal Sportsbiz Pvt. Ltd,ECommerce,Celebrity fashion accessories and merchandise,Mumbai,Accel Partners,PrivateEquity,15000000.0,,2017-11-13
495,14/11/2017,Active AI,Technology,AI based FinTech platform,Bangalore,Vertex Ventures,Private Equity,8250000.0,,2017-11-14
496,15/11/2017,Sumeru,Technology,Banking Software License Platform,Bangalore,Undisclosed Investors,Seed Funding,900000.0,,2017-11-15
498,15/11/2017,Omnia Information,Technology,WiFi Analytics Platform,Delhi,Omidyar Network,Private Equity,3000000.0,,2017-11-15
501,17/11/2017,Kanhaiya,Inspiration,Storytelling platform,Hyderabad,Undisclosed Investors,Seed/Angel Funding,200000.0,,2017-11-17
503,20/11/2017,ONN Bikes,Technology,Self riding bike rental program,Mumbai,Z Nation Lab,Seed/Angel Funding,692000.0,,2017-11-20
504,21/11/2017,Rapido,Technology,Bike and Taxi pooling online platform,Hyderabad,"Skycatcher Fund, Aravind Sanka",Seed/Angel Funding,329230.0,,2017-11-21
505,21/11/2017,Heckyl,Technology,Big Data Analytics Platform,Mumbai,"Notion Capital, IDG Ventures",Private Equity,2700000.0,,2017-11-21
506,21/11/2017,Nuvepro,Technology,Managed Cloud Environment Solutions,Mumbai,1Crowd,Seed/Angel Funding,400000.0,,2017-11-21
507,21/11/2017,RedBook,Technology,AI based pharmacy drugs insights platform,Mumbai,"Vida Ventures, Dr. Aniruddha Malpani",Seed/Angel Funding,250000.0,,2017-11-21
508,21/11/2017,Portea,Healthcare,Healthcare facilities at doorstep,Bangalore,"Sabre Partners, MEMG CDC",Private Equity,26000000.0,,2017-11-21
510,21/11/2017,Epiq Capital,Finance,Tech based investor firm,Mumbai,Global Institutional Investors,Private Equity,200000000.0,,2017-11-21
513,24/11/2017,IDG Ventures,Finance,Venture Capitalist,Bangalore,Uniliver Ventures,Private Equity,10000000.0,,2017-11-24
514,24/11/2017,TempGo,Technology,IoT and SaaS based transportation platform,Goa,Javelin StartupO Victory Fund,Seed/Angel Funding,250000.0,,2017-11-24
515,27/11/2017,Edelweiss,Finance,Diversified Financial,Mumbai,Undisclosed investors,Private Equity,270000000.0,,2017-11-27
516,27/11/2017,ERA,Technology,Identity management platform,Mumbai,Amit Patni,Seed/Angel Funding,39000.0,,2017-11-27
517,27/11/2017,Smaaash,Technology,Virtual Reality based gaming platform,Mumbai,Sixth Sense Ventures,Private Equity,3800000.0,,2017-11-27
518,28/11/2017,Chumbak,Lifestyle,Designer-led consumer products,Bangalore,Gaja Capital,Private Equity,13000000.0,,2017-11-28
519,28/11/2017,FR8,Technology,Online Truck aggregator platform,Chennai,IFMR Capital,Debt Funding,1500000.0,,2017-11-28
520,28/11/2017,MobieFit,Healthcare,Health and fitness based mobile App,Goa,"NB Ventures, MediAssist",Seed/Angel Funding,1350000.0,,2017-11-28
521,28/11/2017,Stanza Living,Technology,Student accommodation platform,Delhi,"Matrix PArtners, Accel",Private Equity,2000000.0,,2017-11-28
524,03/10/2017,Ola Cabs,Consumer Internet,App based cab hailing services,Bangalore,"Tencent, Softbank Group",Private Equity,110000000.0,,2017-10-03
526,04/10/2017,CollPoll,Consumer Internet,Education collaboration platform,Bangalore,Sprout Angels,Seed Funding,306000.0,,2017-10-04
527,04/10/2017,PhonePe,Consumer Internet,Digital Wallet,Bangalore,Flipkart,Private Equity,38700000.0,,2017-10-04
528,05/10/2017,Little Black Book,Consumer Internet,Local Recommendations and Discoveries Platform,New Delhi,"Blume Ventures, IDG Ventures & Indian Angel Network",Private Equity,1000000.0,,2017-10-05
529,05/10/2017,Oorjan,Technology,rooftop solar platform,Mumbai,Globevestor,Seed Funding,450000.0,,2017-10-05
530,05/10/2017,Zefo,ECommerce,Ecommerce Portal for Used Goods,Bangalore,"Sequoia India, Helion Venture Partners, Beenext",Private Equity,9200000.0,,2017-10-05
531,06/10/2017,Yaantra,ECommerce,Mobile repair and Refurbishment platform,New Delhi,Carpediem Capital,Private Equity,3100000.0,,2017-10-06
532,06/10/2017,Farm Taaza,Technology,Fresh Produce SCM company,Bangalore,"Epsilon Venture Partners, Tara India Fund IV and others",Private Equity,8000000.0,,2017-10-06
533,06/10/2017,Drivezy,Consumer Internet,Self Drive car and bike rental platform,Bangalore,"Das Capital, Axan Partners, Das Capital and IT Farm",Private Equity,10000000.0,,2017-10-06
534,06/10/2017,Slice Pay,Consumer Internet,Student Micro-financing platform,Bangalore,"Das Capital, Simile Ventures",Private Equity,2000000.0,,2017-10-06
536,09/10/2017,MyGubbi,eCommerce,Home Interior Designing Seller,Bangalore,"Firoze Irani, Vipul Parekh, Ananda Kallugadde, Rajesh K Murthy",Private Equity,2700000.0,,2017-10-09
539,09/10/2017,OneStepUp,Technology,Education Technology platform,New Delhi,Orient BlackSwan,Seed Funding,336000.0,,2017-10-09
541,10/10/2017,Parallel Dots,Technology,AI-powered deep learning solutions,Gurgaon,"Multipoint Capital,",Private Equity,1400000.0,,2017-10-10
542,10/10/2017,Easy Diner,Consumer Internet,online restaurant reservation platform,Gurgaon,Saama Capital and DSG Consumer Partners,Private Equity,4500000.0,,2017-10-10
543,11/10/2017,Meesho,ECommerce,Online Reseller Network,Bangalore,"SAIF Partners, YCombinator, Venture Highway",Private Equity,3100000.0,,2017-10-11
544,11/10/2017,StanPlus,Logistics,Medical Transportation Services,Hyderabad,KStart Capital,Private Equity,1100000.0,,2017-10-11
545,12/10/2017,UCLID,Technology,"Education Network for Institutions, teachers & Students",Hyderabad,Undisclosed investors,Seed Funding,235000.0,,2017-10-12
546,13/10/2017,Policy Bazaar,Consumer Internet,Online insurance policy aggregator,Gurgaon,"Wellington Management, DG Ventures India, True North",Private Equity,77000000.0,,2017-10-13
547,13/10/2017,Gapoon,Consumer Internet,home maintenance services platform,Bangalore,"Vida Ventures, Snehal Mantri, Anshu Bahadur",Seed Funding,250000.0,,2017-10-13
548,13/10/2017,Chaayos,eCommerce,Online Chai ordering platform,Gurgaon,Tiger Global Management,Private Equity,2000000.0,,2017-10-13
549,16/10/2017,KrazyBee,Consumer Internet,Micro-lending platform,Bangalore,"Xiaomi Technologies, Shunwei Capital",Private Equity,8000000.0,,2017-10-16
550,16/10/2017,Renew Buy,Consumer Internet,Online Insurance Aggregator,New Delhi,Amicus Capital,Private Equity,9200000.0,,2017-10-16
551,17/10/2017,Fingerlix,Consumer Internet,Food Ordering Portal,Bangalore,"Accel Partners, Zephyr Peacock",Private Equity,7000000.0,,2017-10-17
552,18/10/2017,Bank Bazaar,Consumer Internet,Online Financial Marketplace,Chennai,Experian,Private Equity,7000000.0,,2017-10-18
554,18/10/2017,BlackBuck,Logistics,B2B Logistics provider,Bangalore,Innoven Capital,Private Equity,7700000.0,,2017-10-18
555,18/10/2017,LenDen Club,Consumer Internet,Online peer-to-peer lending platform,Mumbai,Undisclosed Investor,Seed Funding,500000.0,,2017-10-18
556,23/10/2017,Toppr,Consumer Internet,Mobile based learning app,Mumbai,"SAIF Partners, Helion Ventures, FIL Capital Management",Private Equity,7000000.0,,2017-10-23
557,23/10/2017,RAW Pressery,Food & Beverage,Cold pressed Juice maker,Mumbai,"DSG Consumer Partners, Sequoia Capital, Saama Capital",Private Equity,6000000.0,,2017-10-23
558,23/10/2017,Cashe,Consumer Internet,app-only lending platform,Mumbai,IFMR Capital,Debt Funding,3100000.0,,2017-10-23
559,23/10/2017,Park Easy,Consumer Internet,Machine learning based parking discovery,Kolkata,Rockstart Accelerator,Seed Funding,118000.0,,2017-10-23
561,24/10/2017,FYRE,Food & Beverage,Herbal energy shot maker,Mumbai,Venture Catalysts,Seed Funding,500000.0,,2017-10-24
562,24/10/2017,ZipLoan,Consumer Internet,SME lending platform,New Delhi,"Matrix Partners India, WaterBridge Ventures, Whiteboard Capital, Sarbvir Singh",Private Equity,3000000.0,,2017-10-24
563,24/10/2017,Skillenza,Consumer Internet,Online Learning Platform,Bangalore,"Blume Ventures, Indian Angel Network",Seed Funding,722000.0,,2017-10-24
566,25/10/2017,SpotDraft,Consumer Internet,Contract Automation,Gurgaon,"Hunch Ventures, Spiral Ventures, 500 Startups, Singapore Angel Network, Citrus Payments",Seed Funding,550000.0,,2017-10-25
567,26/10/2017,Big Basket,eCommerce,Online Grocery portal,Bangalore,Helion Ventures Partners,Private Equity,5000000.0,,2017-10-26
568,27/10/2017,OfBusiness,Technology,B2B Finance & Fulfilment Network,Gurgaon,Kotak Mahindra Bank,Debt Funding,3800000.0,,2017-10-27
570,28/10/2017,CashFree,Technology,Payments Platform for Marketplaces and Fintechs,New Delhi,Y Combinator,Seed Funding,120000.0,,2017-10-28
571,28/10/2017,Ola Cabs,Consumer Internet,App based cab hailing services,Bangalore,ANI Technologies Pvt. Ltd,Private Equity,7700000.0,,2017-10-28
572,30/10/2017,GoldFarm,Food & Beverage,Agriculture Technology,Coimbatore,Mahindra & Mahindra and Infuse Ventures,Private Equity,2000000.0,,2017-10-30
573,31/10/2017,NetMeds,ECommerce,Online Pharmacy,Chennai,TannCam Investment & Sistema Asia Fund,Private Equity,14000000.0,,2017-10-31
574,31/10/2017,MSE,Finance,Equity Stock Exchange,Mumbai,"IL&FS, Trust Capital, Rosy Blue Securities, Radhakrishan Damani and Rakesh Jhunjhunwala",Private Equity,32000000.0,,2017-10-31
575,01/09/2017,Aahaa Stores,eCommece,Online B2B store for office supplies,Chennai,YourNest Angel Fund,Private Equity,1000000.0,,2017-09-01
576,01/09/2017,MFine,Consumer Internet,Online Doctor Discovery platform,Bangalore,"Stellaris Venture Partners, Mayur Abhaya, Rohit MA",Private Equity,1500000.0,,2017-09-01
577,01/09/2017,Canvera,Consumer Internet,Online Photography platform,Mumbai,InfoEdge,Private Equity,1300000.0,,2017-09-01
578,04/09/2017,PrimaryIO,Technology,Application Performance Acceleration,Pune,"Accel Partners, Exfinity Ventures, Partech Ventures",Private Equity,5600000.0,,2017-09-04
579,05/09/2017,Shubh Loans,Consumer Internet,online lending platform,Bangalore,"SRI Capital, BeeNext, Pravega Ventures",Private Equity,1500000.0,,2017-09-05
580,05/09/2017,Nest Education,Technology,EduTech Platform,Gurgaon,"Michael and Susan Dell Foundation, Anand Mahindra",Seed Funding,600000.0,,2017-09-05
581,06/09/2017,Lending Kart,Consumer Internet,Online Lending Platform,Ahmedabad,"Bertelsmann India, Mayfield Capital, Saama Capital, Darrin Capital",Private Equity,10750000.0,,2017-09-06
582,06/09/2017,GoFro,Consumer Internet,Online travel booking platform,New Delhi,"HIS Co. Ltd, MakeMyTrip",Private Equity,10000000.0,,2017-09-06
583,06/09/2017,OncoStem,Healthcare,Medical Diagnostic Solutions,Bangalore,"Sequoia Capital India, Artiman Ventures",Private Equity,6000000.0,,2017-09-06
584,06/09/2017,Power2SME,eCommerce,Buying Club for Small Businesses,Gurgaon,"International Finance Corporation (IFC), Inventus Capital Partners, Accel Partners, Kalaari Capital, and Nandan Nilekani,",Private Equity,26000000.0,,2017-09-06
585,07/09/2017,Credit Vidya,Consumer Internet,Online Credit scoring platform,Mumbai,Matrix Partners,Private Equity,5000000.0,,2017-09-07
587,07/09/2017,OYO Rooms,Consumer Internet,Branded budget hotels marketplace,Gurgaon,"SoftBank Group, Sequoia Capital India, Lightspeed Venture Partners, Greenoaks Capital, Hero Enterprise",Private Equity,250000000.0,,2017-09-07
588,07/09/2017,Early Salary,Consumer Internet,Online Unsecured Lending platform,Pune,IFMR Capital,Debt Funding,780000.0,,2017-09-07
589,07/09/2017,MamaEarth,eCommerce,online babycare products marketplace,Gurgaon,Fireside Ventures,Seed Funding,4000000.0,,2017-09-07
590,07/09/2017,Seniority,eCommerce,Ecommerce portal for senior citizens,Pune,RPG Enterprises,Private Equity,1000000.0,,2017-09-07
591,08/09/2017,AYE Finance,Consumer Internet,Micro Lending Platform,New Delhi,"Triodos Investment Management,",Debt Funding,6900000.0,,2017-09-08
593,11/09/2017,Ecom Express,Logistics,Logistics Solutions provider,New Delhi,Warburg Pincus,Private Equity,30000000.0,,2017-09-11
594,11/09/2017,Call Health,Consumer Internet,Healthcare Services Aggregator,Hyderabad,"Sachin Tendulkar, P.V SIndhu, Pullela Gopichand",Private Equity,6200000.0,,2017-09-11
595,12/09/2017,Sattviko,eCommerce,Health Food etailer,New Delhi,"Raman Roy, Arvind Uppal, Sonu Bhasin, G Ravishankar",Seed Funding,320000.0,,2017-09-12
596,12/09/2017,3HCare,Consumer Internet,Healthcare services portal,New Delhi,Undisclosed Investor,Seed Funding,100000.0,,2017-09-12
597,12/09/2017,Tonbo Imaging,Technology,Imaging Technology for Armed Forces,Bangalore,"WRV Capital, Qualcomm Ventures, Edelweiss Private Equity, Artiman Ventures",Private Equity,17000000.0,,2017-09-12
598,12/09/2017,Get My Parking,Consumer Internet,Smart Parking Enabler,New Delhi,"IAN Fund, Beenext, Indian Angel Network",Private Equity,3000000.0,,2017-09-12
600,13/09/2017,Glowroad,Consumer Internet,women focussed customer-to-customer reseller network,Bangalore,"Accel Partners,",Private Equity,2000000.0,,2017-09-13
601,13/09/2017,OYO Rooms,Consumer Internet,udget hotel marketplace,Gurgaon,China Lodging Group,Private Equity,10000000.0,,2017-09-13
602,13/09/2017,Unacademy,Consumer Internet,Online learning platform,Mumbai,"Sequoia Capital India, SAIF Partners, Nexus Venture Partners and Blume Ventures,",Private Equity,11500000.0,,2017-09-13
603,13/09/2017,Heterogenous,Technology,Telecom & IoT platform,Chennai,"Chennai Angels, Keiretsu Forum & Others",Seed Funding,780000.0,,2017-09-13
605,14/09/2017,Smaaash,Technology,Virtual Reality gaming and entertainment platform,Mumbai,ECL Finance,Private Equity,44000000.0,,2017-09-14
606,14/09/2017,WheelStreet,Consumer Portal,Bike Rental Platform,Bangalore,Y Combinator,Seed Funding,120000.0,,2017-09-14
608,18/09/2017,The Moms Co,eCommerce,Pregnancy & Baby Care product etailer,Gurgaon,"DSG Consumer Partners, Saama Capital",Private Equity,1000000.0,,2017-09-18
609,19/09/2017,Noticeboard,Technology,"mobile-first communication platform for on-field staff,",Bangalore,"Shamik Sharma, Aprameya Radhakrishna",Seed Funding,1200000.0,,2017-09-19
610,19/09/2017,High Radius,Technology,Integrated receivables software solutions,Hyderabad,Susquehanna Growth Equity LLC,Private Equity,50000000.0,,2017-09-19
612,21/09/2017,SaveBC,Finance,financial services firm,Gaya,Incofin Investment Management.,Private Equity,6000000.0,,2017-09-21
615,21/09/2017,Homergize,eCommerce,Home Furnishing & Building material marketplace,Bangalore,LG Chandrasekhar,Private Equity,1000000.0,,2017-09-21
616,22/09/2017,Yatra.com,eCommerce,Online Travel Agency,Gurgaon,InnoVen Capital India,Debt Funding,15400000.0,,2017-09-22
617,22/09/2017,Ace Turtle,Technology,Omni-channel web commerce solutions provider,Bangalore,InnoVen Capital,Private Equity,5000000.0,,2017-09-22
619,25/09/2017,Synup,Technology,SME Marketing Management Solution,Bangalore,"Vertex Ventures, Prime Venture Partners.",Private Equity,6000000.0,,2017-09-25
622,25/09/2017,Rapido,Consumer Internet,Bike Aggregator Mobile App,Bangalore,Battery Road Digital Holdings LLC,Seed Funding,422000.0,,2017-09-25
623,25/09/2017,Sportobuddy,Consumer Internet,Sports & Sport related equipment portal,Mumbai,Mehul Shah,Seed Funding,150000.0,,2017-09-25
627,27/09/2017,Transerve,Technology,Geospatial Technology-based SaaS solutions,Mumbai,"IL&FS Investment Managers, Omidyar Network.",Private Equity,1600000.0,,2017-09-27
629,27/09/2017,Pitstop,Consumer Internet,Car repair and Servicing Platform,Bangalore,"Blume Ventures, Goldbell Group, Anurag Srivastava, Shailesh Rao, Amiya Pathak, Rajesh Yohanan and Rahul Garg",Private Equity,1000000.0,,2017-09-27
631,27/09/2017,MyUpchar,Consumer Internet,Local Language Health Information portal,New Delhi,LetsVenture,Seed Funding,300000.0,,2017-09-27
632,28/09/2017,Aadyah,Technology,Defense Tech & Aerospace startup,Bangalore,Keiretsu Forum,Private Equity,1000000.0,,2017-09-28
633,01/08/2017,TouchKin,Technology,Predictive Care Platform,Bangalore,Kae Capital,Private Equity,1300000.0,,2017-08-01
636,02/08/2017,Zepo,Consumer Internet,DIY Ecommerce platform,Mumbai,"Kunal Shah, LetsVenture, Anupam Mittal, Hetal Sonpal",Seed Funding,500000.0,,2017-08-02
637,02/08/2017,Click2Clinic,Consumer Internet,healthcare service aggregator,Hyderabad,"Narottam Thudi, Shireesh Palle",Seed Funding,850000.0,,2017-08-02
638,03/08/2017,SpeedBox,Logistics,On-Demand Logistics Service provider,Mumbai,Cismat Cargo Services Pvt. Ltd.,Seed Funding,300000.0,,2017-08-03
641,03/08/2017,Zoctr,Consumer Internet,Health Products & Services Aggregator,Mumbai,SIDBI,Private Equity,1000000.0,,2017-08-03
646,08/08/2017,New Castle Technologies,Technology,Hospital Management Software,Chennai,Undisclosed investors,Seed Funding,243000.0,,2017-08-08
647,08/08/2017,My Forex Eye,Consumer Internet,foreign exchange services,New Delhi,"Rahul Dev Kumar, Rajesh Mahajan, Ankit Sharma and others",Seed Funding,220000.0,,2017-08-08
648,09/08/2017,TruxApp,Logistics,Mobile based Logistics Service,New Delhi,"Venugopal Dhoot, Ajay Bhatia, Tarun Khandelwal, Ganpat Singhvi, Mandhian family & Others",Seed Funding,3100000.0,,2017-08-09
649,09/08/2017,CroFarm,Technology,Agriculture Supply Chain solutions,Gurgaon,Factor[e] Ventures,Seed Funding,783000.0,,2017-08-09
652,11/08/2017,Flipkart,eCommerce,Online Marketplace,Bangalore,Softbank,Private Equity,2500000000.0,,2017-08-11
654,11/08/2017,Ola Cabs,Consumer Internet,App based cab aggregation Service,Gurgaon,Tekne Capital Management,Private Equity,36000000.0,,2017-08-11
656,14/08/2017,Digilend,Technology,Personal Loans & EMI solutions platform,Mumbai,"InCred Finance, Fullerton India Credit Company Ltd",Seed Funding,312000.0,,2017-08-14
657,15/08/2017,KNAB Finance,Consumer Internet,Unsecured Small Business Loans,Bangalore,"InCred, Krishnakumar Natarajan, Ravi Bhardwaj",Seed Funding,385000.0,,2017-08-15
659,20/08/2017,Rootefy,eCommerce,Building material online store,New Delhi,"Abhinav Gupta,",Seed Funding,187000.0,,2017-08-20
660,21/08/2017,Uniphore,Technology,speech recognition startup,Chennai,IDG Ventures,Private Equity,6800000.0,,2017-08-21
661,21/08/2017,Cerebroz,Consumer Internet,E-Tech platform,Vadodara,Undisclosed HNI\\xe2\\x80\\x99s,Seed Funding,734000.0,,2017-08-21
665,23/08/2017,Dhruva,Technology,Cloud data protection and management solutions,Pune,"Riverwood Capital, Sequoia Capital India, Nexus Venture Partners, Tenaya Capital",Private Equity,80000000.0,,2017-08-23
666,23/08/2017,Bombay Shaving Company,eCommerce,Men Grooming product etailer,New Delhi,Fireside Ventures,Private Equity,2300000.0,,2017-08-23
668,23/08/2017,Indiez,Technology,Software & Mobile app development platform,Bangalore,Haresh Chawla,Seed Funding,500000.0,,2017-08-23
669,24/08/2017,Ezetap,Technology,mPOS solutions provider,Bangalore,"JS Capital Management, Social Capital, Horizons Ventures,",Private Equity,16000000.0,,2017-08-24
670,25/08/2017,Ink Monk,Consumer Internet,Online printing marketplace,Chennai,"VAMM Ventures, Raksul, Dena",Seed Funding,750000.0,,2017-08-25
671,25/08/2017,Medinfi,Consumer Internet,Online Doctor Discovery Platform,Bangalore,"PBS Srinivas, Vinod Martin,",Seed Funding,125000.0,,2017-08-25
672,28/08/2017,Mobikon,Technology,Restaurant & Hotel CRM platform,Pune,"Sistema Asia Fund, C31 Ventures, Qualgro.",Private Equity,7000000.0,,2017-08-28
673,29/08/2017,CureFit,Consumer Internet,End to End health and wellness platform.,Bangalore,"Accel Partners, IDG Ventures, Kalaari Capital,\\xc2\\xa0 UC-RNT fund",Private Equity,25000000.0,,2017-08-29
674,29/08/2017,Doxper,Technology,Healthtech IoT platform,Mumbai,"idal Health, growx ventures, Capier Investments, Globevestor & others",Seed Funding,750000.0,,2017-08-29
676,30/08/2017,Treebo,Consumer Internet,Budget Hotel Aggregator platform,Bangalore,"Ward Ferry Management and Karst Peak Capital,",Private Equity,34000000.0,,2017-08-30
677,30/08/2017,MedGenome,Technology,Genomics Research and Diagnostics Solutions,Bangalore,"Sequoia India, Sofina s.a., Zodius Capital, Kris Gopalakrishnan, Lakshmi Narayanan,",Private Equity,30000000.0,,2017-08-30
678,01/07/2017,Billion Loans,Consumer Internet,Peer to Peer Lending platform,Bangalore,Reliance Corporate Advisory Services Ltd,Seed Funding,1000000.0,,2017-07-01
679,03/07/2017,Ecolibriumenergy,Technology,Energy management solutions provider,Ahmedabad,"Infuse Ventures, JLL",Private Equity,2600000.0,,2017-07-03
680,04/07/2017,Droom,eCommerce,Online marketplace for automobiles,Gurgaon,"Asset Management (Asia) Ltd, Digital Garage Inc",Private Equity,20000000.0,,2017-07-04
681,05/07/2017,Jumbotail,eCommerce,online marketplace for food and grocery,Bangalore,"Kalaari Capital, Nexus India Capital Advisors",Private Equity,8500000.0,,2017-07-05
682,05/07/2017,Moglix,eCommerce,B2B marketplace for Industrial products,Noida,"International Finance Corporation, Rocketship, Accel Partners, Jungle Ventures, Shailesh Rao, Venture Highway",Private Equity,12000000.0,,2017-07-05
683,05/07/2017,Timesaverz,Consumer Internet,Hyperlocal home services provider,Mumbai,BCCL,Private Equity,1000000.0,,2017-07-05
686,07/07/2017,Clip App,Consumer Internet,Digital Media Video platform,Bangalore,"India Quotient, Shunwei Capital",Seed Funding,1000000.0,,2017-07-07
688,10/07/2017,Autorox.co,Technology,Workshop Management Software Platform,Hyderabad,Mitsui & Co.,Private Equity,3000000.0,,2017-07-10
689,11/07/2017,Fabogo,Consumer Internet,Salon & Spa Aggregation & Discovery platform,Pune,Dunamis Ventures Pte Ltd,Private Equity,2250000.0,,2017-07-11
690,11/07/2017,Flickstree,Consumer Internet,Video Content Discovery Platform,Mumbai,"Venture Catalysts, Sourav Ganguly, Ankit Aditya, Moksh Sports Ventures",Seed Funding,464000.0,,2017-07-11
692,12/07/2017,Innoviti,Technology,Digital payments solutions,Bangalore,"SBI-FMO Fund, Bessemer Venture Partners, Catamaran Ventures",Private Equity,18500000.0,,2017-07-12
696,14/07/2017,QwikSpec,Technology,Construction site operations and analytics platform,Bangalore,"Brigade Innovations LLP, TV Mohandas Pai, Suhail Rahman, Bobby Reddy, M George Oommen",Seed Funding,540000.0,,2017-07-14
697,14/07/2017,Chumbak,eCommerce,Designer consumer products Marketplace,Bangalore,Blacksoil Capital Pvt. Ltd,Private Equity,1700000.0,,2017-07-14
698,17/07/2017,Increff,Technology,Sales Solutions for Fashion Brands,Bangalore,"Sequoia Capital, Grey Orange, Rajesh Ramaiah, Anshuman Das, Rishi Das",Seed Funding,2000000.0,,2017-07-17
699,17/07/2017,Vayana,Technology,Enterprise Banking Solutions,Pune,"IDG Ventures India Advisors, Jungle Ventures",Private Equity,4000000.0,,2017-07-17
704,19/07/2017,Rentomojo,Consumer Internet,Consumer Leasing Platform,Bangalore,"ain Capital Ventures, Renaud Laplanche",Private Equity,10000000.0,,2017-07-19
706,19/07/2017,Playablo,Technology,Gamified Learning App,Bangalore,ABI-Showatech (India) Ltd,Seed Funding,600000.0,,2017-07-19
707,20/07/2017,Trupay,Technology,Online payments platform,Gurgaon,"Kae Capital, M&S Partners,",Seed Funding,700000.0,,2017-07-20
708,21/07/2017,Brick2Wall,eCommerce,Online Marketplace for Construction Material,Gurgaon,"Subramani Somasundaram, Sundeep Sahni, Mayank Mittal & Others",Seed Funding,200000.0,,2017-07-21
712,25/07/2017,Noticeboard,Consumer Internet,Mobile-first Enterprise communication platform,Bangalore,"Stellaris Venture Partners,",Private Equity,1200000.0,,2017-07-25
713,25/07/2017,Byju\\xe2\\x80\\x99s,Consumer Internet,Mobile Learning App,Bangalore,Tencent Holdings,Private Equity,35000000.0,,2017-07-25
715,26/07/2017,Fab Hotels,Consumer Internet,Budget hotels brand & Aggregator Platform,New Delhi,Goldman Sachs,Private Equity,25000000.0,,2017-07-26
716,26/07/2017,ThinkerBell,Consumer Internet,Assisted Learning Startup,Bangalore,"Indian Angel Network, Anand Mahindra",Seed Funding,200000.0,,2017-07-26
717,27/07/2017,1mg,eCommerce,Online Pharmacy,Gurgaon,"HBM Healthcare Investments, Maverick Capital Ventures, Sequoia India, Omidyar Network and Kae Capital",Private Equity,15000000.0,,2017-07-27
718,28/07/2017,Jhakaas,Consumer Internet,App-based Aggregator of Offline Businesses,Mumbai,Amen Dhyllon,Seed Funding,155000.0,,2017-07-28
719,28/07/2017,BigStylist,Consumer Internet,Beauty Services Marketplace,Mumbai,Info Edge (India) Ltd,Private Equity,1250000.0,,2017-07-28
722,02/06/2017,RentOnGo,eCommerce,"Online Marketplace for Renting Bikes, Electronics & Appliances",Bangalore,TVS Motor Company,Seed Funding,234000.0,,2017-06-02
723,05/06/2017,Goomo,Consumer Internet,Online Travel & Holiday Booking platform,Mumbai,Emerging India,Private Equity,50000000.0,,2017-06-05
725,06/06/2017,Spinny,eCommerce,Online Used Car marketplace,Gurgaon,"Blume Ventures, Indian Angel Network, Kunal Shah, Sandeep Tandon",Private Equity,1000000.0,,2017-06-06
728,06/06/2017,BHIVE Workspace,Consumer Internet,co-working spaces,Bangalore,Blume Ventures,Private Equity,1200000.0,,2017-06-06
729,06/06/2017,wayForward,Consumer Internet,Mobile app for Mental Health,New Delhi,"Harsh Mahajan, Farhan Naqvi, Sreepathy Viswanathan",Seed Funding,1000000.0,,2017-06-06
732,07/06/2017,ZipLoan,Consumer Internet,Online lending platform,New Delhi,WaterBridge Ventures,Seed Funding,650000.0,,2017-06-07
733,07/06/2017,GrowFitter,Consumer Internet,health and fitness discovery platform,Mumbai,SQue Capital,Seed Funding,600000.0,,2017-06-07
734,08/06/2017,Stratfit,Consumer Internet,Health coaching programs,Hyderabad,Bodhtree Consulting Limited,Seed Funding,232000.0,,2017-06-08
735,08/06/2017,Multiplier Solutions,Technology,CRM Software for Healthcare space,Hyderabad,Norwest Venture Partners,Private Equity,1500000.0,,2017-06-08
736,08/06/2017,ABI Health,Technology,Unified Digital Health Platform,Bangalore,Norwest Venture Partners,Private Equity,1500000.0,,2017-06-08
737,08/06/2017,Stockal,Consumer Internet,App-based Investment advisory Services,Bangalore,"Mohan Alexander, R. Natarajan, Vikrant Varshney, Amit Sinha",Seed Funding,350000.0,,2017-06-08
738,09/06/2017,Guidoo,Consumer Internet,Travel & adventure planning platform,Mumbai,"Pawan Borle, Nirmal Singh, Manish Prasad, Vineet Varma, Nick Haulkoury, Abhai S. Rao",Seed Funding,300000.0,,2017-06-09
739,09/06/2017,eSahai.in,Consumer Internet,ambulance aggregator and medical taxi provider,Hyderabad,"Dr Ramesh Ayyala, Satya Muthyala",Seed Funding,250000.0,,2017-06-09
741,12/06/2017,LendingKart,Consumer Internet,Online Lending platform,Ahmedabad,Yes Bank,Debt Funding,7800000.0,,2017-06-12
742,12/06/2017,Boxx.ai,Technology,Artificial Intelligence,Bangalore,"Unicorn India Ventures, Venky Krishnakumar, Suresh Shankar, Vivek Bhargava",Private Equity,500000.0,,2017-06-12
743,12/06/2017,PeeSafe.in,Healthcare,Hygiene care product manufacturer,New Delhi,"Venture Catalysts, Alfa Capital, Green Shots Capital, Real Time Ventures",Private Equity,1000000.0,,2017-06-12
744,12/06/2017,Vista Rooms,Consumer Internet,Online rooms aggregation platform,Mumbai,"Artha India Ventures, Singularity Holdings, Rajan Anandan, Girish Mathrubootham",Seed Funding,776000.0,,2017-06-12
745,12/06/2017,CoverFox,Consumer Internet,Online insurance brokerage platform,Mumbai,Transamerica,Private Equity,15000000.0,,2017-06-12
747,13/06/2017,Goodera,Technology,CSR and sustainability management platform,Bangalore,"Nexus Venture Partners, Omidyar Network",Private Equity,5500000.0,,2017-06-13
748,13/06/2017,Digit,Technology,Tech driven Insurance platform,Bangalore,Fairfax Holdings,Private Equity,45000000.0,,2017-06-13
749,14/06/2017,Ola,Consumer Internet,Cab Aggregation App,Bangalore,Tekne Capital Management LLC,Private Equity,50000000.0,,2017-06-14
751,14/06/2017,MrNeeds,Consumer Internet,Micro Food Delivery platform,Noida,undisclosed investors,Seed Funding,500000.0,,2017-06-14
752,15/06/2017,MoneyTap,Consumer Internet,Money Lending platform,Bangalore,"Sequoia India, NEA, Prime Venture Partners",Private Equity,12300000.0,,2017-06-15
753,16/06/2017,Goodbox,eCommerce,Mobile SAAS\\xc2\\xa0 ECommerce platform for SMEs,Bangalore,"Nexus Venture Partners, Mekin Maheshwari",Private Equity,1000000.0,,2017-06-16
754,16/06/2017,Fincash,Consumer Internet,Personal Finance platform,Mumbai,"Mohammed Khan, Sameer Narayan & Others",Seed Funding,100000.0,,2017-06-16
755,16/06/2017,PortDesk,Technology,Maritime Solutions,Noida,Alphard Maritime Group,Seed Funding,2000000.0,,2017-06-16
757,16/06/2017,EazyDiner,Consumer Internet,Online Restaurant Reservation Platform,Gurgaon,YouWeCan Ventures,Seed Funding,4425000.0,,2017-06-16
759,19/06/2017,Unbxd,Technology,Cloud-based product discovery platform,Bangalore,Eight Roads Ventures,Private Equity,12500000.0,,2017-06-19
760,19/06/2017,DarwinBox,Technology,Enterprise human resources management platform,Hyderabad,"Lightspeed India Partners, Endiya Partners, 3one4 Capital Advisors LLP, Startupxseed Ventures LLP",Private Equity,4000000.0,,2017-06-19
761,20/06/2017,ForeverShop,Consumer Internet,Mobile based ecommerce platform,Bangalore,91maker.com,Seed Funding,300000.0,,2017-06-20
762,20/06/2017,Insider.in,Consumer Internet,Events Ticketing platform,Mumbai,Paytm,Private Equity,5200000.0,,2017-06-20
763,21/06/2017,Fynd,eCommerce,Fashion etailer,Mumbai,"IIFL Seed Ventures, Kae Capital, FJ Labs, Singularity Ventures, GrowX, Tracxn Labs, Axis Capital",Private Equity,2400000.0,,2017-06-21
764,21/06/2017,Grow Fit,Consumer Internet,Health-Tech platform,Bangalore,"Manipal Education and Medical Group (MEMG), SAR Group, The Grover Trust",Private Equity,4500000.0,,2017-06-21
765,21/06/2017,Fabulyst,Technology,Artificial Intelligence based platform,Hyderabad,iBhubs,Seed Funding,215000.0,,2017-06-21
766,21/06/2017,mSwipe,Technology,Point-of-Sale services,Mumbai,"UC-RNT Fund, Matrix Partners, alcon Edge Capital, DSG Consumer Partners",Private Equity,31000000.0,,2017-06-21
767,21/06/2017,OneAssist,Consumer Internet,Credit card fraud protection,Mumbai,Sequoia Capital,Private Equity,7500000.0,,2017-06-21
768,22/06/2017,Julia Computing,Technology,Open Source Language for Data Science and Machine Learning,Bangalore,"General Catalyst, Founder Collective",Private Equity,4600000.0,,2017-06-22
769,22/06/2017,Kissht,Consumer Internet,Consumer Lending platform,Mumbai,"Endiya Partners, Ventureast",Private Equity,2000000.0,,2017-06-22
770,22/06/2017,Explore Life traveling,Consumer Internet,Local homes booking platform,Bangalore,"Mekin Maheshwari, Bharat Vijay, Krish Seshadri, Amar Arsikere",Seed Funding,500000.0,,2017-06-22
771,23/06/2017,Loantap,Consumer Internet,Lending platform for salaried professionals,Mumbai,"Kae Capital, India Quotient, IFMR, and MAS Financial Services Ltd",Private Equity,4000000.0,,2017-06-23
772,23/06/2017,Voxweb,Consumer Internet,Mobile based social networking platform,Mumbai,Undisclosed investors,Seed Funding,1000000.0,,2017-06-23
773,26/06/2017,HUG Innovations,Technology,Gesture based\\xc2\\xa0 Smartwatch manufacturer,Hyderabad,"Mohit Srivastav, Kishore Ganji, Venkat Vallabhaneni, Rajeev Menon",Private Equity,5000000.0,,2017-06-26
774,26/06/2017,Flipkart,eCommerce,Online marketplace,Bangalore,Naspers,Private Equity,71000000.0,,2017-06-26
775,26/06/2017,V Resorts,Consumer Internet,Holiday & Vacation resort aggregator,Noida,"Seedfund, RB International",Private Equity,4000000.0,,2017-06-26
776,27/06/2017,Stashfin,Consumer Internet,Personal Finance App,New Delhi,"Snow Leopard Ventures, Alto Partners",Private Equity,5000000.0,,2017-06-27
778,27/06/2017,Spares Hub,eCommerce,Automobile parts marketplace,Pune,"The Chennai Angels, Anthill Scale Ventures, Esvee Technologies Inc, Inc95 Consulting",Seed Funding,311000.0,,2017-06-27
780,28/06/2017,Rubique,Consumer Internet,Online Marketplace for financial products,Mumbai,"Kalaari Capital, Udayan Goyal",Private Equity,3000000.0,,2017-06-28
781,28/06/2017,Niki.ai,Consumer Internet,AI Based Personal Assistant,Bangalore,"SAP.iO, Unilazer Ventures",Private Equity,2000000.0,,2017-06-28
782,29/06/2017,Fitpass,Consumer Internet,Online Fitness Marketplace,New Delhi,"Abhinav Bindra, Gaurav Marya",Private Equity,1000000.0,,2017-06-29
784,30/06/2017,Tagos Design,Technology,in-video discovery platform,Bangalore,Undisclosed Investors,Private Equity,5000000.0,,2017-06-30
785,30/06/2017,UrbanClap,Consumer Internet,Mobile Services Marketplace,Gurgaon,"Vy Capital, SAIF Partners, Accel Partner, Bessemer Venture Partners",Private Equity,21000000.0,,2017-06-30
786,01/05/2017,Ace2three,Consumer Internet,Online Rummy playing Website,Hyderabad,Clairvest Group,Private Equity,73700000.0,,2017-05-01
787,01/05/2017,Power2SME,eCommerce,Buying portal for SMEs,Gurgaon,International Finance Corporation,Private Equity,10000000.0,,2017-05-01
788,02/05/2017,Innovapptive,Technology,Enterprise Mobility Solutions,Hyderabad,Hyderabad Angels,Seed Funding,1500000.0,,2017-05-02
789,02/05/2017,4tigo,Logistics,Truck Network company,Bangalore,"Accel Partners, Nandan Nilekani,",Private Equity,10000000.0,,2017-05-02
791,02/05/2017,ZippServe,Consumer Internet,Real estate risk assessment platform,Bangalore,undisclosed investors,Seed Funding,390000.0,,2017-05-02
792,03/05/2017,Ola,Consumer Internet,Cab Aggregation App,Bangalore,"Falcon Edge Capital,\\xc2\\xa0 Capital Advisers",Private Equity,104500000.0,,2017-05-03
793,03/05/2017,Sumeru,Technology,Software & Mobile development services,Bangalore,undisclosed investors,Seed Funding,1000000.0,,2017-05-03
794,04/05/2017,Healthians,Consumer Internet,Online Diagnostics and wellness platform,New Delhi,"Asuka Holdings, YouWeCan Ventures, Beenext, Beenos, M&S Partners",Private Equity,9000000.0,,2017-05-04
799,05/05/2017,Balance App,Consumer Internet,Money Savings & Management App,Bangalore,Rainmatter,Seed Funding,233000.0,,2017-05-05
800,08/05/2017,YepMe,eCommerce,Private Label Fashion etailer,Gurgaon,"Rainbow Digital Services Pvt. Ltd, ILearnFinance Academy Pvt. Ltd.",Private Equity,700000.0,,2017-05-08
803,08/05/2017,MyGreens,Food & Beverage,Cold-press Juices manufacturer,New Delhi,"Ajay Relan, LetsVenture",Seed Funding,1000000.0,,2017-05-08
804,08/05/2017,Ace Turtle,Technology,Omni-Channel Platform,Bangalore,"Vertex Ventures, C31 Ventures",Private Equity,5000000.0,,2017-05-08
805,08/05/2017,CureFit,Technology,Health-Tech Platform,Bangalore,"Trifecta Capital Advisors LLP, Prathithi Investment Trust, RNT Capital, Gokul Rajaram, Aditya Agarwal, Ruchi Sanghvi & others",Private Equity,3200000.0,,2017-05-08
806,09/05/2017,Curie Labs,Technology,Energy Analytics startup,New Delhi,Satoshi Studios,Seed Funding,50000.0,,2017-05-09
808,09/05/2017,Anchanto,Technology,Ecommerce Fulfilment and Technology Platform,Pune,Luxasia Group,Private Equity,4000000.0,,2017-05-09
811,10/05/2017,Vidooly,Consumer Internet,Video Intelligence platform,Noida,"Times Internet, GVFL",Private Equity,1400000.0,,2017-05-10
812,10/05/2017,Shopclues,eCommerce,Online marketplace,Gurgaon,InnoVen Capital,Private Equity,7700000.0,,2017-05-10
813,10/05/2017,Fourth Ambit,Consumer Internet,Community Building platform,Bangalore,1Crowd,Seed Funding,600000.0,,2017-05-10
815,11/05/2017,Early Salary,Consumer Internet,Online lending platform,Pune,"DG Ventures India, Dewan Housing Finance Corp",Private Equity,4000000.0,,2017-05-11
818,12/05/2017,Legal Raasta,Consumer Internet,Legal Services to SMEs & Individuals,New Delhi,Impanix Capital,Private Equity,5000000.0,,2017-05-12
820,12/05/2017,Remit Guru,Consumer Internet,Digital money transfer platform,Mumbai,"Infibeam, CCavenue",Private Equity,466000.0,,2017-05-12
821,12/05/2017,Aequm,eCommerce,Cloud ECommerce platform,Bangalore,undisclosed investors,Seed Funding,1000000.0,,2017-05-12
822,15/05/2017,Zapty,Technology,Project Management tool,Bangalore,IdeaSpring Capital,Seed Funding,500000.0,,2017-05-15
824,16/05/2017,Niki.ai,Technology,AI-based chatbot,Bangalore,SAP,Private Equity,2000000.0,,2017-05-16
825,16/05/2017,Telr,Technology,Online Payment Gateway,Mumbai,Innovations East,Private Equity,3000000.0,,2017-05-16
826,16/05/2017,Fynd,eCommerce,Fashion ECommerce Portal,Mumbai,Rocketship,Private Equity,500000.0,,2017-05-16
827,17/05/2017,Genie,Consumer Internet,hyperlocal delivery and logistics mobile app,Chennai,undisclosed investors,Seed Funding,250000.0,,2017-05-17
828,17/05/2017,Paysense,Consumer Internet,Online Lending platform,Mumbai,Jungle Ventures,Private Equity,5300000.0,,2017-05-17
